text,rating,cleaned_review
"Hugely Disappointing!!  Based on all the other reviews maybe they were have an off night?  We already decided not to give it a 2nd try.....

We were seated and given menus but waited a good 10 minutes for them to come back for drink orders.  Then we waited a good 15 minutes for our dirty Kettle One martini's to come and waiting to order.  While we were waiting as patiently as we could the waiter takes the full order (drinks, apps, meal) of the couple who were seated 15 minutes after we arrived! Of course I would be understanding on the wait if the place was packed but there were only 5 tables filled in the entire place!!

We finally ordered and the watier came back 3 different times to clarify what we ordered.

The complimentary bread finally arrived along with our drinks, which by the way were terrible and in filthy (spotty, lipstick stained, crusty).  The bread was really great though so I started to have hope.

From the App's the Scallop and Goat cheese was great- the duck and mushroom was bland.

Main meal of pork chops and sea bass were boring. 

Oh when we got the bill they only did Well Martini's- would that have explained the poor taste or do they just not know how to make?

Bottom Line Summary:

Service Slow
Waiter Confused
Martini Horrible
Dirty Dirty Glasses
Food sounds GREAT but tastes quite bland.

Very Disappointing.",1,hugely disappointing based reviews maybe night already decided give try seated given menus waited good minutes come back drink orders waited good minutes dirty kettle one martini come waiting order waiting patiently could waiter takes full order drinks apps meal couple seated minutes arrived course would understanding wait place packed tables filled entire place finally ordered watier came back different times clarify ordered complimentary bread finally arrived along drinks way terrible filthy spotty lipstick stained crusty bread really great though started hope app scallop goat cheese duck mushroom bland main meal pork chops sea bass boring oh got bill well would explained poor taste know make bottom line summary service slow waiter confused martini horrible dirty dirty glasses food sounds great tastes quite bland disappointing
"Without a doubt the worst Chinese restaurant in Cleveland . The restaurant is located in an old McDonald's building barely fitted for a sit down restaurant.  

I ordered an egg roll - it was average - mustard and ketchup containers used for hot mustard and sweet and sour - cute. 

I ordered walnut chicken - a ""new"" menu item - it was horrible. I was expecting something fast fried in a brown sauce and stir fried with honey walnuts. What I received was a pile of ""white"" fried chicken with a flavorless sauce and some walnuts thrown in. It tasted like cornstarch -the sauce had absolutely no flavor - I would have added soy sauce, but I don't need the extra sodium and there might not have been enough in the restaurant to spice it up.   

The service was extremely friendly and very attentive - so much so that I couldn't bring myself to complain about the food.  I simply asked for a carryout container, boxed it up, and threw it out at my hotel.  

It was really cheap though - $15.00 for entree and egg roll.  I was on my expense account, so it didn't bother me to go somewhere else to eat that night.  

But do yourself a favor - this place is not good.  Ignore the internet reviews.  I can't believe that anything here has any flavor....",1,without doubt worst chinese restaurant cleveland restaurant located old mcdonald building barely fitted sit restaurant ordered egg roll average mustard ketchup containers used hot mustard sweet sour cute ordered walnut chicken new menu item horrible expecting something fast fried brown sauce stir fried honey walnuts received pile white fried chicken flavorless sauce walnuts thrown tasted like cornstarch sauce absolutely flavor would added soy sauce need extra sodium might enough restaurant spice service extremely friendly attentive much could bring complain food simply asked carryout container boxed threw hotel really cheap though entree egg roll expense account bother go somewhere else eat night favor place good ignore internet reviews ca believe anything flavor
"Not trying to rain on anyone's parade. There just aren't any choices here if you're vegetarian or vegan. Well. There's one. And you have to ask for no pork. And then the little guy (who was VERY nice by the way) asked if I ate no meat and when I said yes he said ""I'll ask them to cook it in water because there is beef in the broth."" ?? Okay. The sauce was super salty, not spicy like on the menu, and the tofu was very slimy. Anyway, it wasn't great. But I ate it.",2,trying rain anyone parade choices vegetarian vegan well one ask pork little guy nice way asked ate meat said yes said ask cook water beef broth okay sauce super salty spicy like menu tofu slimy anyway great ate
"It's amazing how things can go so wrong.

On a 9 a.m. visit, the first thing I noticed was that this shop offers soups, sandwiches, and salads.  I wasn't in the mood for typical breakfast items. I asked the attendant whether they were serving sandwiches.  I even pointed to sandwiches on the menu.  No, he replied, only breakfast items (bacon, sausage, or ham and egg croissants or bagels).

You can't nuke a croissant.  My $4 croissant was no better than a cheap Jimmy Dean frozen sausage croissant from the grocery store. It came with coffee that was nothing special. I pumped the coffee from dispensers that ran dry.  You get better coffee from 7-Eleven.

I noticed servers standing around the soup and salad area.  Out of curiosity, I asked if they were serving soup and sandwiches.  Yes, they serve soup, salad, and sandwiches all day.

I asked the attendant who helped me at first.  ""I thought you said you weren't serving sandwiches.""
   ""Oh no.  We serve them all day!""

What can you do?  I spoke English and apparently he understood it.  What went wrong is anyone's guess.  My first experience here was highly negative.  It's a nice shop, however.  The attendant was friendly and pleasant. Maybe the misunderstanding was somehow all my fault.

Rather than buy anything here, pick up a cheap breakfast sandwich at the nearby Terrible's convenience store. 

Or, take your chances on their soups, sandwiches, and salads. There are pretty pictures all around the shop that make the offerings look tasty.",1,amazing things go wrong visit first thing noticed shop offers soups sandwiches salads mood typical breakfast items asked attendant whether serving sandwiches even pointed sandwiches menu replied breakfast items bacon sausage ham egg croissants bagels ca nuke croissant croissant better cheap jimmy dean frozen sausage croissant grocery store came coffee nothing special pumped coffee dispensers ran dry get better coffee noticed servers standing around soup salad area curiosity asked serving soup sandwiches yes serve soup salad sandwiches day asked attendant helped first thought said serving sandwiches oh serve day spoke english apparently understood went wrong anyone guess first experience highly negative nice shop however attendant friendly pleasant maybe misunderstanding somehow fault rather buy anything pick cheap breakfast sandwich nearby terrible convenience store take chances soups sandwiches salads pretty pictures around shop make offerings look tasty
"sick...and not in the way my college roommate use to say ""that's sick! "" (meaning cool, awesome, sweet, wicked (variation of any of the previous). No this was just gross. 

After driving across town to two different malls to find a particular dress in my size, I worked up quite the appetite. Hey it's Friday- I'll go for some Americanized Asian...so I ordered the general Tso's with a maki roll ( not sushi- this is what they call their spring rolls), and noodles.

My noodles were cold...like really cold. The portion was beyond stingy- normally with these kind of take-out restaurants I cannot finish my meal, but their were exactly 11 pieces of chicken 7 of which were teeny-tiny bits... The texture of both meat and noodles was very mushy and overall not so tasty. When I paid with debit the girl at the counter literally handed my receipt and said ""sign-this"" ...so much for service. I will say it was cheap and the spring roll was edible. 

I should have known better than to give into mall food cravings...not worth the calories. But hey on a positive note I did find my dress size at CP Mall!",1,sick way college roommate use say sick meaning cool awesome sweet wicked variation previous gross driving across town two different malls find particular dress size worked quite appetite hey go americanized asian ordered general tso maki roll call spring rolls noodles noodles cold like really cold portion beyond normally kind restaurants finish meal exactly pieces chicken bits texture meat noodles mushy overall tasty paid debit girl counter literally handed receipt said much service say cheap spring roll edible known better give mall food cravings worth calories hey positive note find dress size cp mall
Do not eat here! Found hair in food and the manager did not care. Will be filing complaint with health department,1,eat found hair food manager care filing complaint health department
"It's always hit or miss depending on who is cooking the chicken. The guy they usually have is lazy, it's better when he's off or on break! . The chicken and shrimp were both undercooked today and lacking teriyaki. Considering they have only a 91.5 on their last inspection that's doubly concerning. 
Today it was overly greasy, and lacking any flavor. A little salt and pepper added during cookie by go a long way FYI. 
Cut back on the butter and oil , it's not healthy and like I said very greasy today. The veggies were overlooked and wilty. Sad. 
They need a new guy on the Chicken, this one has no pride and it shows.",1,always hit miss depending cooking chicken guy usually lazy better break chicken shrimp undercooked today lacking teriyaki considering last inspection doubly concerning today overly greasy lacking flavor little salt pepper added cookie go long way fyi cut back butter oil healthy like said greasy today veggies overlooked wilty sad need new guy chicken one pride shows
"UGH.........
I stopped by the deli today to grab a sandwich for lunch.  Not many other places in this area to eat so I thought it to be a good choice.  WRONG!!!  So I bought a chicken salad sandwich on a salt bagel and it looked so delectable but as I was eating it I heard a little voice from my tummy - 'not good'.  I just thought that maybe I was disappointed that the sandwich looked so good but didn't taste as good as it looked.  However, 30 minutes later I felt the BBG's (bubbly gut) and off to the toilet I ran.  Soooooo embarrassing when you're stuck in the bathroom at work for half the day.  To make matters worse, my co-worker offered to run to the drugstore to buy me some Kaopectate.  Yeah...not my finest hour.  Thanks Brooklyn Bagels!!!",1,ugh stopped deli today grab sandwich lunch many places area eat thought good choice wrong bought chicken salad sandwich salt bagel looked delectable eating heard little voice tummy good thought maybe disappointed sandwich looked good taste good looked however minutes later felt bbg bubbly gut toilet ran soooooo embarrassing stuck bathroom work half day make matters worse offered run drugstore buy kaopectate yeah finest hour thanks brooklyn bagels
"I was expecting to get fresh bagels in here but it seemed as if these bagels have been sitting around since yesterday. I believe I have experienced better bagels at the grocery store. The cream cheese was good. For a bagel place, I expect more. I shall try them again. Maybe they could redeem themselves.",2,expecting get fresh bagels seemed bagels sitting around since yesterday believe experienced better bagels grocery store cream cheese good bagel place expect shall try maybe could redeem
"Honestly... pretty rough looking place... but the food is edible.
I struggle between a 2 and 3 star rating on this one

PROS:
Local;
Provider of ""comfort foods"";
Inexpensive;
Good people watching (late-night and early-AM)

CONS:
Very outdated--in much need of an update/remodel;

Good for an early breakfast or a late-night dinner or dessert!
The 1/2 Angry Mob is killer!  LOL
(its a gazillion scoops of vanilla and chocolate ice cream garnished with large ""frownie"" brownies all over!  Love it!",2,honestly pretty rough looking place food edible struggle star rating one pros local provider comfort foods inexpensive good people watching cons outdated much need good early breakfast dinner dessert angry mob killer lol gazillion scoops vanilla chocolate ice cream garnished large frownie brownies love
"I used to be sold to Ora. Great food, great vibe, excellent service. However I just have experienced the worst service ever in a restaurant in my life, and I do not recommend this place to anyone.

We waited for 50 minutes to get a table, with a reservation!
We then waited at least 40 minutes to get water. 
No service, no waitress, nothing. And no one seemed to care.

The place is overcrowded, the music is too loud and its full of douchebags and bimbo with fake boobs.

The service is terrible, no one knows what they are doing, or where to go.

I will not go again. It is a terrible place",1,used sold ora great food great vibe excellent service however experienced worst service ever restaurant life recommend place anyone waited minutes get table reservation waited least minutes get water service waitress nothing one seemed care place overcrowded music loud full douchebags bimbo fake boobs service terrible one knows go go terrible place
Still closed from the flood last year in July? It is now Jan 2014 and boarded up still?,1,still closed flood last year july jan boarded still
"Preface: I live in the Bay Area now, and I don't know many Pittsburgh restaurants beyond Primanti Bros.  Further, I booked a dinner at this ""Kitchen and Wine Bar"" before I knew that my companions were not in a wine mood.  Anyways...

The good news is the service and ambiance were excellent.  All of the servers were friendly and attentive, and the decor was modern yet soothing.  They knew where I could park without feeding a meter and without getting a ticket -- try getting that info on the Embarcadero!

Unfortunately, I was disappointed in the food.  The salmon tartare was very fishy - mostly the salmon ""caviar.""  The saffron rice (sidenote: are you afraid to call it risotto because you're in Aspinwall?   (a) don't be; and (b) then call it very creamy round grained rice, apparently cooked in broth) was so salty that I actually asked myself if I had done something to offend the chef.  He couldn't have meant for it to be this salty, unless he recognizes me from 7th grade study hall or something (and if so, put away the salt shaker and come out of the kitchen --  I haven't forgotten either!)  The short ribs were soft but not as soft as they should be.

Final note: they offered me a free dessert, which was a nice enough touch that I might actually go back, in the hopes that I just caught the chef on an off night.  Hmmm.  Maybe I do forgive and forget.",2,preface live bay area know many pittsburgh restaurants beyond primanti booked dinner kitchen wine bar knew companions wine mood anyways good news service ambiance excellent servers friendly attentive decor modern yet soothing knew could park without feeding meter without getting ticket try getting info embarcadero unfortunately disappointed food salmon tartare fishy mostly salmon caviar saffron rice sidenote afraid call risotto aspinwall b call creamy round grained rice apparently cooked broth salty actually asked done something offend chef could meant salty unless recognizes grade study hall something put away salt shaker come kitchen forgotten either short ribs soft soft final note offered free dessert nice enough touch might actually go back hopes caught chef night hmmm maybe forgive forget
"Drinks overpriced.  Crowd was somewhat geriatric, except for us, of course!  We didn't have dinner, so can't comment on that.  Will probably go back to give it one more try.",2,drinks overpriced crowd somewhat geriatric except us course dinner ca comment probably go back give one try
The worse take out Chinese food I've ever had! The pineapple chicken was nicely disguised but underneath was full of fat bony parts and hardly any meat. 3 out of the 5 dishes I ordered were wrong. At least the egg rolls were edible! Won't be going back. Waste of money.,1,worse take chinese food ever pineapple chicken nicely disguised underneath full fat bony parts hardly meat dishes ordered wrong least egg rolls edible wo going back waste money
"We dropped in last Thursday night and it was the worse meal ever.  It was not busy,
yet it took 40 minutes to get the appetizer and over an hour to get a sandwich which
arrived cold.  The steak was as thick as a pancake, yet was priced as though it were
a good cut.  Would not recommend this restaurant to friends.  A big disappointment!",1,dropped last thursday night worse meal ever busy yet took minutes get appetizer hour get sandwich arrived cold steak thick pancake yet priced though good cut would recommend restaurant friends big disappointment
RIP. This place is now closed down. It is turning into another Lindo Michoacan.,1,rip place closed turning another lindo michoacan
"Super super weird place. Says it's a restaurant but they only had fish and chips on the menu. Groups of homeless people sitting in groups and drinking beer. My son studies at Kumon next door & I was starving- wouldn't have come otherwise. 

They've got a pool table though. If you're looking for $3 beer, love the smell of urine and are feeling adventurous I highly recommend it.",1,super super weird place says restaurant fish chips menu groups homeless people sitting groups drinking beer son studies kumon next door would come otherwise got pool table though looking beer love smell urine feeling adventurous highly recommend
"I am not surprised that I am the first to review.
I must also disclose that this will be one the few times that I will write a review based on ONE visit - I normally like to visit at least twice but I would like to live to see another day, and I'm afraid that may not happen if I go there again.

Background: me and few friends had been eyeing this spot for a while; but it gave an eerie feeling and we never ventured. Believing in the power in numbers and in the spirit of adventure, 3 of us went - apparently that was not enough.

The decor? non-existent.
menu? well, most were not available but regular pub food. We got burgers and onion rings and pitcher of beer. I will say that was the crispiest rings ever!made me miss Harvey's onion rings very much. Hamburgers were bland and had a home-made quality, definitely filling. The BLT sandwich was just that: bacon, lettuce, tomato between toasts - nothing else....for $4.

Based on the above, I would have returned except, things got weird. 
The crowd there - sketchy at best (but in that weirdly frightening way- not in the Parkdalian kinda way ), is what would prevent the second visit.

People were watching us, music turned out loudly and someone on his way out to pee(I'm told), stopped behind my friend and gave me a look. A few minutes later, my friends who are born and raised in the small town ways, strongly advised that i finish the beer - and I did as I was told.
As we left, someone half way followed us and another man started screaming - and the staff were nonchalant and indifferent about a mini-fight or the strange group of people just hovering the counter; they weren't going to help us if anything happened.

So.
If you are feeling brave and adventurous, this is where you go. Otherwise, Ronsey is filled with other joyful spots than this, where you don't feel life threatened.",1,surprised first review must also disclose one times write review based one visit normally like visit least twice would like live see another day afraid may happen go background friends eyeing spot gave eerie feeling never ventured believing power numbers spirit adventure us went apparently enough decor menu well available regular pub food got burgers onion rings pitcher beer say crispiest rings ever made miss harvey onion rings much hamburgers bland quality definitely filling blt sandwich bacon lettuce tomato toasts nothing else based would returned except things got weird crowd sketchy best weirdly frightening parkdalian kinda way would prevent second visit people watching us music turned loudly someone way pee told stopped behind friend gave look minutes later friends born raised small town ways strongly advised finish beer told left someone half way followed us another man started screaming staff nonchalant indifferent strange group people hovering counter going help us anything happened feeling brave adventurous go otherwise ronsey filled joyful spots feel life threatened
"i have to agree with Shinyi very weird crowd and i can handle rough places.They have to own the building, you could not pay rent selling 3 dollar beers to alcoholics living in nearby roominghouse. very brave to order food the bathroom was bad enough.lower roncy could use a good biker bar, someone needs to take it over.",1,agree shinyi weird crowd handle rough building could pay rent selling dollar beers alcoholics living nearby roominghouse brave order food bathroom bad roncy could use good biker bar someone needs take
"I have to say this location offers visitors a very nice expensive meal if that is what they are looking for.  Within walking distances to this property are many authentic Pittsburgh choices.  I found Lydia's place to be well run, exceptional service, but rather expensive.  Also I found the dish I ordered to be very salty.",2,say location offers visitors nice expensive meal looking within walking distances property many authentic pittsburgh choices found lydia place well run exceptional service rather expensive also found dish ordered salty
"Rude, rude, RUDE! And not good food. I'm not just basing this on one visit. I will always give a second chance. The second time I visited, it was worse! 

And to SanMeGal K:
Before you go calling names, I ordered it take-out both times.",1,rude rude rude good food basing one visit always give second chance second time visited worse sanmegal k go calling names ordered times
"If you're going to be cash-only, state it obviously in the menu and put a sign at the door.  The first time I ordered I ordered with a group, we all had cash so we didn't really think about it.  Then we I went to the actual store we placed out huge order, got everything set and then BAM ""No, no, Cash Only.""

I don't mind it ... but PLEASE, a fair warning would have been nice.  As for the food ... it's average at best.  We've tried general tso, chicken with broccoli, and orange chicken.  Nothing to write home about.",2,going state obviously menu put sign door first time ordered ordered group cash really think went actual store placed huge order got everything set bam cash mind please fair warning would nice food average best tried general tso chicken broccoli orange chicken nothing write home
What to say about Chenoy's had many 2AM dinners there over the decade!!! I tend to go there because its open 24H a day not because the food is actually amazing. They have several smoked meat dishes which are okay and it does the jog!!! The menu has a basically almost everything but wouldn't say anything really stands out in terms of dishes.,2,say chenoy many dinners decade tend go open day food actually amazing several smoked meat dishes okay jog menu basically almost everything would say anything really stands terms dishes
"Une horreur !

On est peut etre mal tombé mais je donne mon avis quand même. 
Nous passons commande a 18h... le livreur arrive a 20h !!! J'avais appeler 3x et a chaque fois une personne qui ne parle bien ni le français ni l'anglais me . disait 5-10 minutes.

Tout est arrivé tiede voir froid...

Plus jamais !",1,une horreur est peut etre mal tombé mais je donne mon avis quand même nous passons commande le livreur arrive appeler et chaque fois une personne qui ne parle bien ni le français ni disait minutes tout est arrivé tiede voir froid plus jamais
"Went here for lunch. Really slow service. People who sat down after us got served as well as got their food before us. My burger wasn't cooked well and tasted awful. When I told them it didn't taste great, they didn't take it back and didn't offer to remove it from the bill. Fries were cold as well. Overpaid for a lunch that made me sick. Won't be going back",1,went lunch really slow service people sat us got served well got food us burger cooked well tasted awful told taste great take back offer remove bill fries cold well overpaid lunch made sick wo going back
I liked the waitress she was nice. However did not enjoy the food. Didn't like their house Italian. Not sure what they put in it. The croutons were saturated with butter. The wedding soup was similar with Eat N Park. The chicken piccata was ok but the sauce could have had a bit more of a bite. The manicotti tasted like it had been frozen. Don't get the raspberry chicken.,1,liked waitress nice however enjoy food like house italian sure put croutons saturated butter wedding soup similar eat n park chicken piccata ok sauce could bit bite manicotti tasted like frozen get raspberry chicken
