text,rating,cleaned_review
"Just left there after ordering a family pack, one of my sandwiches was supposed to have chicken instead of steak. All the sandwiches had steak-umms, when I called to let them know the lady got snippy instead of being apologetic, save yourself the headache of patronizing this sub par overpriced establishment!",1,left ordering family pack one sandwiches supposed chicken instead steak sandwiches called let know lady got snippy instead apologetic save headache patronizing sub par overpriced establishment
"I placed an uber eats order with them and it was delivered incorrect.  I paid extra money to get bacon that i did not get. I had a total of 4 fries in my large fry order and I ordered a orange pop that was not given to my uber driver to give to me. I went to the store to let them know things were wrong with my order and the owner cut me off from talking and said ""let me talk first, then you go"" she went on to read my order to me and show me irreverent receipts. I then asked her if I could now talk and let her know why I am here. She admitted I did not get my drink but argued with me about my other concerns, she says she watched her husband put the bacon on my sandwich even though I told her he did not. She wanted me to stay in the store and wait for her to replay they video of him putting bacon on my sandwich.  I told her I did not have time to do that due to me having to get back to work. But who in they right mind would argue with a paying customer. Before leaving she then told me, I don't need to be using uber and that uber is for ppl who don't have a car or can't get out the house. She said I'm paying more through uber than I have to. I explained to her that even though I have a car, I can not always leave my job and yes I know I paid more but I paid for the convenience which came out to be the exact opposite.  I will NEVER spend any of my money with them ever again",1,placed uber eats order delivered incorrect paid extra money get bacon get total fries large fry order ordered orange pop given uber driver give went store let know things wrong order owner cut talking said let talk first go went read order show irreverent receipts asked could talk let know admitted get drink argued concerns says watched husband put bacon sandwich even though told wanted stay store wait replay video putting bacon sandwich told time due get back work right mind would argue paying customer leaving told need using uber uber ppl car ca get house said paying uber explained even though car always leave job yes know paid paid convenience came exact opposite never spend money ever
I hate giving this type of review.. But they don't wash their hands. She will come from outside go to the register collect the money and then start helping him with the food. Just nasty!! This is the 2nd time I had to ask her to wash her hands or give me my money back.. I'm sorry no more chances. But I will say she is nice but just nasty.,2,hate giving type review wash hands come outside go register collect money start helping food nasty time ask wash hands give money back sorry chances say nice nasty
I would actually like to give them a -1. We went there yesterday around 8:30 and the sign in the door says they closed at 9:00. Another lady was talking to the person who worked there and she said they close at 830 so they can clean. What's up with that? Any retail place I worked at we would close the store at closing time and then do what we needed to get the store ready for the next day not close a half hour early and miss out for sales.,1,would actually like give went yesterday around sign door says closed another lady talking person worked said close clean retail place worked would close store closing time needed get store ready next day close half hour early miss sales
"I visited Dish 1st week of September. The one thing I realized about this place was how overpriced everything was. Breakfast burrito - $9? Grilled chicken that was laying out in the deli  (no sauce or condiments) $8? There is another place like Dish that sells the exact same chicken for $5. I order the pizza at the restaurant and it was a really salty. I should have just went to Domino's.

I really had a hard time believing the prices they are charging for a grilled sandwich (almost $10) to pasta. Are you kidding me? Then I realized I'm in Scottsdale where people will eat anything in front of them as long as that place looks trendy (see Olive and Ivy). 

The concept is pretty good. You can pick up stuff for home if you don't have time to make anything. I think the prices are restaurant prices for a take out place. 

I think the location of Dish will attract considerable traffic. It's a huge place that offers pick up and a sit down restaurant. Most of the employees knew what they were talking about and were friendly. But, it's vastly overpriced for what they offer.

Update 9/12/07: People have said that the food is pricey, but it's Scottsdale...so it comes with the territory. That's what's wrong with most people. Location should not justify the prices, the food should. Actually, I don't mind spending money if the food is worth it (in fact, my favorite local seafood restaurant is Wildfish, not inexpensive). 

But, the food is alright compared to the prices. If you're a bit lazy and can't make a sandwich yourself at home, then by all means..spend $10+ for a sandwich here.  I think this is definitely catering to the right crowd.  This place is a larger, overpriced LGO with marginal food. I've tried the pizza, grilled chicken sandwich, burrito, and sushi. All were OK.  Perhaps, I am fortunate that my client/work pays whenever I go there. I think there are other places I would go to spend my OWN money.

I think Dish will do well because of it's location and because it is Scottsdale..where most people don't have a discerning taste bud.  

One positive thing I will say is that it's a quick, easy place to get a meal and the employees seem knowledgeable about what they sell. So, if you're not in the mood to cook or even sure what to eat, but want a myriad of overpriced choices then Dish is for you. 

Again, this is a personal opinion. I'm not trying to offend anyone.",2,visited dish week september one thing realized place overpriced everything breakfast burrito grilled chicken laying deli sauce condiments another place like dish sells exact chicken order pizza restaurant really salty went domino really hard time believing prices charging grilled sandwich almost pasta kidding realized scottsdale people eat anything front long place looks trendy see olive ivy concept pretty good pick stuff home time make anything think prices restaurant prices take place think location dish attract considerable traffic huge place offers pick sit restaurant employees knew talking friendly vastly overpriced offer update people said food pricey scottsdale comes territory wrong people location justify prices food actually mind spending money food worth fact favorite local seafood restaurant wildfish inexpensive food alright compared prices bit lazy ca make sandwich home means spend sandwich think definitely catering right crowd place larger overpriced lgo marginal food tried pizza grilled chicken sandwich burrito sushi perhaps fortunate pays whenever go think places would go spend money think dish well location scottsdale people discerning taste bud one positive thing say quick easy place get meal employees seem knowledgeable sell mood cook even sure eat want myriad overpriced choices dish personal opinion trying offend anyone
"I give them a 2 not a 1 because they actually had the best ribs ever!. They were over priced and the corn bread and various other things had trans fat in it. I confronted the president to alert them of my finding. 
I told them I saw it listed in the ingredients on the corn bread. 
Then questioned why have a bakery and have fresh baked bread when your using the ingredients of a sit on the shelf forever and not go bad bread?

She wrote back and told me they called the chef and they dont use it. 
WTF?
Its on the ingredients on the package, you idiot.
She didnt even know what was in the food so she told me a lie.

Weird, they didnt even make a lot of the stuff there. Thats why she didnt know",2,give actually best ribs ever priced corn bread various things trans fat confronted president alert finding told saw listed ingredients corn bread questioned bakery fresh baked bread using ingredients sit shelf forever go bad bread wrote back told called chef dont use wtf ingredients package idiot didnt even know food told lie weird didnt even make lot stuff thats didnt know
"Too bad this restaurant couldn't work out all of the kinks I pointed out in my original review. Sadly, I saw Dish closing 6 months ago.",2,bad restaurant could work kinks pointed original review sadly saw dish closing months ago
"Chase G.? That's a big ole fail on you. 240 N. Sunway in Gilbert is, in fact, a tire store. Thanks for ruining my lunch small dancing rodent!!",1,chase big ole fail sunway gilbert fact tire store thanks ruining lunch small dancing rodent
"I so wanted to like this place.  Stopped in on a Thursday night, giddy with dessert excitement.  It took awhile for someone to acknowledge us and take our order.  The waitstaff seemed stressed, annoyed, and inexperienced.  But at this point I'm still thinking it's all going to be worth it.  What a disappointment.  The desserts we tried were bland and dry.  I tend to like things that aren't overly sweet, so it's not that I was expecting an explosion of sweetness and flavor, but I was expecting *some* flavor.  Especially for the price!  Maybe they have something worth eating, but I'm not going to waste any more of my time or money to find out.  The one plus - the water must be filtered because it was actually drinkable.",1,wanted like place stopped thursday night giddy dessert excitement took awhile someone acknowledge us take order waitstaff seemed stressed annoyed inexperienced point still thinking going worth disappointment desserts tried bland dry tend like things overly sweet expecting explosion sweetness flavor expecting flavor especially price maybe something worth eating going waste time money find one plus water must filtered actually drinkable
"I've always wondered about this place and finally tried it out with a friend who has been before.

To begin, you should be coming here with a truckstop diner mentality. Don't expect a hipstery brunch joint serving chorizo bennies with a side of duck fat avocado fries (oh man, i don't know if that's even a thing but i want it to be now!) This is a truckstop diner in all its glory. Large portions, probably oversalted food, very efficient service (truckstop servers are my favourite for this reason), retro diner ambience (but not forced retro), and neverending coffee.

I got the chicken fried steak with mashed potatoes, gravy, and steamed veg. Very salty, even for a sodiumphile like myself. Also tried the pierogies and sausage which were alright, as well as the hamburger steak.

Probably a great option for those lazy weekend mornings when you feel like going out for a huge, greasy, breakfast but don't want to line up with everyone else for the newest, cool, brunch place. +1 for credit card pay phones at some tables and the wall of stuffed husky toy animals at the front.",2,always wondered place finally tried friend begin coming truckstop diner mentality expect hipstery brunch joint serving chorizo bennies side duck fat avocado fries oh man know even thing want truckstop diner glory large portions probably oversalted food efficient service truckstop servers favourite reason retro diner ambience forced retro neverending coffee got chicken fried steak mashed potatoes gravy steamed veg salty even sodiumphile like also tried pierogies sausage alright well hamburger steak probably great option lazy weekend mornings feel like going huge greasy breakfast want line everyone else newest cool brunch place credit card pay phones tables wall stuffed husky toy animals front
The Cleveland Grill has sadly gone out of business.,1,cleveland grill sadly gone business
Service is good 6 oz steak plain and tiny the size of a golf ball not worth the 23 bucks,1,service good oz steak plain tiny size golf ball worth bucks
"While John's (our server) performance was impeccable, I doubt we'll be returning any time soon. My crab cake was VERY fishy tasting and Tuesday's only offered a very blah cocktail sauce - no teriyaki, soy or other flavor masker. My bride's chicken fresco was noticeably dry and her favorite vegetable, steamed broccoli, was not warm enough to melt the ""butter"" that John served after being asked for it. Her mashed cauliflower (which she couldn't bring herself to insist I try) was ""not quite what I remember"".

We didn't partake of the salad bar ... it was nicely presented but compared to Dessey's or a Sizzler it was seriously lacking.

Bottom line, if we get another ($10 max) 2 for 1 coupon we might return for a (see previous ratings) highly rated turkey burger. On the other hand, In-N-Out  is hard to resist when it come to burgers.

BTW, I'm glad we didn't take the (5 & 13) kids with us. There was nothing that would have appealed to them on the menu and we'd have had to stop at McDonald's to feed them later.",2,john server performance impeccable doubt returning time soon crab cake fishy tasting tuesday offered blah cocktail sauce teriyaki soy flavor masker bride chicken fresco noticeably dry favorite vegetable steamed broccoli warm enough melt butter john served asked mashed cauliflower could bring insist try quite remember partake salad bar nicely presented compared dessey sizzler seriously lacking bottom line get another max coupon might return see previous ratings highly rated turkey burger hand hard resist come burgers btw glad take kids us nothing would appealed menu stop mcdonald feed later
"I don't know what is up with this Ruby's. I have had very good experiences at other locations but from now on I avoid this one. 

The server never came back to check on us, I asked for my burger medium rare and it was well done, and the waiter kept making weird comments to people at our table. For the price of the meal I would have been better off staying home and wouldn't have had to put up with such awful service.",1,know ruby good experiences locations avoid one server never came back check us asked burger medium rare well done waiter kept making weird comments people table price meal would better staying home would put awful service
"My girlfriend wanted to eat here since we've seen the commercials down in So Cal. Now I have eaten at a Ruby Tuesday before in Cleveland, OH, and I thought this one would be the same as its midwestern counterpart. Wow, this Ruby Tuesday was completely different. From the outside it looked like a Cocos or Sizzler. The Ruby Tuesday in Cleveland looked and felt like an upscale Chilis but with a better menu. They even had Stella Artois (my favorite beer) on tap!

The service here was okay at best, but the food was disappointing, especially after having an amazing experience at another RT. If you want to eat at a Ruby Tuesday, you might as well go to one in the midwest. Stay away from this one.",2,girlfriend wanted eat since seen commercials cal eaten ruby tuesday cleveland oh thought one would midwestern counterpart wow ruby tuesday completely different outside looked like cocos sizzler ruby tuesday cleveland looked felt like upscale chilis better menu even stella artois favorite beer tap service okay best food disappointing especially amazing experience another rt want eat ruby tuesday might well go one midwest stay away one
"Food was awful, the restaurant was filthy (Health Department should be involved), bugs crawling around ankles and human feces around the toilet.",1,food awful restaurant filthy health department involved bugs crawling around ankles human feces around toilet
"Went in with a restaurant.com certificate. Was told it was no good on Fridays. Told waitress there was no date restriction on the certificate. She said they would accept it but I had to spend $50, not the $35 stated on the certificate. She said the manager changed the rules and it wouldn't  help to talk to him. A lady at the next table waved her certificate, she had the same problem. If the owner contracts with restaurant.com to sell discounted certificates, he should honor the contract!  We left never to return.",1,went certificate told good fridays told waitress date restriction certificate said would accept spend stated certificate said manager changed rules would help talk lady next table waved certificate problem owner contracts sell discounted certificates honor contract left never return
"I went here for the first time with a group of people and we all tried different items, the only items that were good were the mussels. Everything else was poor over priced food. Stay away!!!",1,went first time group people tried different items items good mussels everything else poor priced food stay away
"Absolutely the worst experience I've ever had at a restaurant. Went in with a restaurant.com certificate, and after we had ordered our food, the waitress tells us that the certificate was no good because the manager made a mistake with the gift certificate and we would have to pay full price. I asked to see the manager and the waitress started yelling at me, saying that was the policy and the manager was not available.  I was astounded because: A) this was the restaurants fault and I should not be punished for their ineptitude and B) the waitress ended up yelling at me when I had simply asked to see the manager.  

As this was by far the worst service I have ever seen at any establishment, I did not leave a tip which which resulted in the waitress chasing me into the parking lot yelling obscenities at me. 

Aside from this incident, the food was mediocre and overpriced, and I would not return there even without the debacle.  Stay away.",1,absolutely worst experience ever restaurant went certificate ordered food waitress tells us certificate good manager made mistake gift certificate would pay full price asked see manager waitress started yelling saying policy manager available astounded restaurants fault punished ineptitude b waitress ended yelling simply asked see manager far worst service ever seen establishment leave tip resulted waitress chasing parking lot yelling obscenities aside incident food mediocre overpriced would return even without debacle stay away
"I am not in the habit of dissing restaurants. However, I owe it to the unsuspecting to do so now. Bathroom:filthy. Service: waited an hour for food. Quality:oysters were not edible--set them aside and ate the overlooked shrimp and fries.",1,habit dissing restaurants however owe unsuspecting bathroom filthy service waited hour food quality oysters edible set aside ate overlooked shrimp fries
No stars. Lobby and outside disgusting. Kitchen door open to outside and no screens to keep flies out. Was looking forward to some good seafood....ugh.,1,stars lobby outside disgusting kitchen door open outside screens keep flies looking forward good seafood ugh
Terrible service.  Awful food do not eat here. Awful on both counts. Just terrible. I had to beg for service. The food took forever and was almost inedible. Do not eat here. Then the obnoxious trivia game began. I could not get out fast enough,1,terrible service awful food eat awful counts terrible beg service food took forever almost inedible eat obnoxious trivia game began could get fast enough
"The food is horrible; It's all frozen processed food and way over priced ($14+ for a dinner entree). I gave a two star rating because it is mainly a bar, and that aspect of the place isn't as bad. It's a dive-like bar, but they pour strong drinks.",2,food horrible frozen processed food way priced dinner entree gave two star rating mainly bar aspect place bad bar pour strong drinks
"This place is a joke. I went for oysters since I just started getting into them and I have to admit, this is the worst place for them. I ordered a few to try and tried to order something else off the menu but when I tried, it was like EVERYTHING was unavailable at the moment. How can you make money if you have nothing to sell? Ended up with 6 oysters and a burger. Waste of time and money.",1,place joke went oysters since started getting admit worst place ordered try tried order something else menu tried like everything unavailable moment make money nothing sell ended oysters burger waste time money
"I was excited about trying this place but didn't even make it inside.  The outside area smells like an ash tray and is filthy.  There's a pot right outside the door filled with cigarette butts.   When I opened the door, the entry way was as bad, if not, worse than the outside.  It wreaked of cigarettes and filthy.  We turned around and left right away.  Let me know when the place is cleaned and I may be back.",1,excited trying place even make inside outside area smells like ash tray filthy pot right outside door filled cigarette butts opened door entry way bad worse outside wreaked cigarettes filthy turned around left right away let know place cleaned may back
"Saw this place and decided to give it a try but didn't make it past the front door.  There were cigarette butts all over the side walk,. We opened the door to a little room/ entryway area  and it smelled terrible like mildew, plus it was extremely dirty. For us that was a deal breaker and made us wonder what their kitchen must  look like.",1,saw place decided give try make past front door cigarette butts side walk opened door little entryway area smelled terrible like mildew plus extremely dirty us deal breaker made us wonder kitchen must look like
Their batter is way too heavy for the sesame beef and general tao chicken. As if they used too much corn starch maybe? In both cases you get these hard lumps that are partially air filled and barely have chicken/beef inside. The sauce for both is also way too sweet. The sweet sugary taste overwhelms any other taste. Shrimps in lobster sauce were extremely salty. It was overall just quite disappointing.,1,batter way heavy sesame beef general tao chicken used much corn starch maybe cases get hard lumps partially air filled barely inside sauce also way sweet sweet sugary taste overwhelms taste shrimps lobster sauce extremely salty overall quite disappointing
"Health nuts (and those looking for lighter fare) will love that the food is free of heavy seasonings. But the portions are tiny and, my God, is the service here slow and rude. Perhaps that's why Sushi San, despite occupying one of the most visible spots in the food court, attracts hardly any customers even during peak hours. Once I asked for rice and vegetables in separate containers (as opposed to one on top of the other in a cramped bowl, making it impossible to enjoy the two together). The server flatout refused without even a trivial apology.",2,health nuts looking lighter fare love food free heavy seasonings portions tiny god service slow rude perhaps sushi san despite occupying one visible spots food court attracts hardly customers even peak hours asked rice vegetables separate containers opposed one top cramped bowl making impossible enjoy two together server flatout refused without even trivial apology
"The Good:
SO and I both ordered Unagi bowls. The unagi itself was good, and that's the only reason I gave this two stars instead of one. 
The Bad:
The veggies served with it were not great, and it did not come with miso soup, unlike all of their other ""bowls"". Also, it took an extremely long time to receive our relatively simple meals, around fifteen-twenty minutes. This was because he completely forgot about us and only remembered when my SO went up and to ask about the food. Moreover, he and I watched as the worker (probably also the manager) argued with a customer, saying that she had already received her food, when it was clear it was a different girl who happened to order the same item. 

Overall, would not return, especially with Sushi Ichiban so close, and with more reasonable prices.",2,good ordered unagi bowls unagi good reason gave two stars instead one bad veggies served great come miso soup unlike bowls also took extremely long time receive relatively simple meals around minutes completely forgot us remembered went ask food moreover watched worker probably also manager argued customer saying already received food clear different girl happened order item overall would return especially sushi ichiban close reasonable prices
"this was not yummy or freshish or really ok. but if you insist on a california roll and happen to be trapped in the illini union at the time, how bad could it be?",1,yummy freshish really insist california roll happen trapped illini union time bad could
"I did not enjoy my experience here. My boyfriend and I were kind of excited to see that their nachos come topped with bacon. When the waitress (finally) came by to ask how everything was, I asked her if there was supposed to be bacon and she simply said ""yes it's small"".. it was just lackluster service and food quality.

It's a get-what-you-pay-for experience, I guess. It's close to the Bell Centre, but so are other places that will have better food and service. The only thing I really liked was that you can have free popcorn... that's pretty fun :)",2,enjoy experience boyfriend kind excited see nachos come topped bacon waitress finally came ask everything asked supposed bacon simply said yes small lackluster service food quality experience guess close bell centre places better food service thing really liked free popcorn pretty fun
