text,rating,cleaned_review
"I feel bad about giving this place two stars... really.

Last sunday, my mom and I were out on a power shopping spree at the pavillions when she said she wanted to go to Souper Salad, not wanting to i begruggingly agreed. We even dug through our back seat looking for their coupon in the sunday paper for a discount! We walked up and sat down and saw their DIRTY patio furniture... wtf?! Don't these people own a hose?! That was so dirty, I couldn't imagine trying to have a nice al fresco dining experience there! Luckily for me, it was the dirtiest part of the resturant.

We approached the door when a very loud man came and opened the door and exchanged pleasantries over and over again and was very happy to see us. Ummm... thanks? but can we atleast order our drinks first? He was a little happy. I unno - I was in a good mood, but I sorta just wanted to be left alone to eat. We got our salads and the greens were semi wilted and the cesar salad needed to be refilled but didn't :( and so I was left with some odd franken salad I threw together on my own. It wasn't that great - but that's my own doing. 

Their pasta salads and cole slaw and some of their fixin's looked very old and unappetizing! I couldn't even imagine eating them! I wished they had potato salad or carrot slaw (is that the word?) and macaroni salad... it wasn't good. But things did lighten up when I came across the soups.

I loooove soups!! They are my salvation after a hard day. I cozied up to a lil bowl of tomato based soup with mini shell pasta and veggies, it was delish! So was the Veggie Beef soup. I wish it didn't have so much onion,but I'm not a big fan of onions. and their tacos were GOOOOOD... not write home and tell everyone about it good... but very good. They remind me of the kind of tacos you make at home, out of a box but not all craptastic like how they come out when I do it. I honestly liked it. 

The cornbread was dry and my mom said her baked potato was too. The pizza looked too old to touch, so I unno about that one. 

The service was another thing... the same man, who I'm assuming is the owner always kept talking. Even when my mom said something along the lines of just wanting to enjoy our meals and we thanked him for his hospitatlity. But damn... SHUT UP! I felt like he wanted to sit down and talk shop with us... but we weren't there to meet with him... we were there to talk with one another. But he always refilled our drinks and cleared our plates away quickly. So he got to keeep a star. 

To my fellow yelpers: if you're in the area and want fresh salads, this might not be the place for you... especially if you want to eat outside cafe style on nice clean patio furniture... but if you want a nice cozy bowl (or several like me) of soup and decent bread sticks then this place will hit the spot. You might need to shoo away the owner though in order to get some privacy and enjoy the people you arrive there with.",2,feel bad giving place two stars really last sunday mom power shopping spree pavillions said wanted go souper salad wanting begruggingly agreed even dug back seat looking coupon sunday paper discount walked sat saw dirty patio furniture wtf people hose dirty could imagine trying nice al fresco dining experience luckily dirtiest part resturant approached door loud man came opened door exchanged pleasantries happy see us ummm thanks atleast order drinks first little happy unno good mood sorta wanted left alone eat got salads greens semi wilted cesar salad needed refilled left odd franken salad threw together great pasta salads cole slaw fixin looked old unappetizing could even imagine eating wished potato salad carrot slaw word macaroni salad good things lighten came across soups loooove soups salvation hard day cozied lil bowl tomato based soup mini shell pasta veggies delish veggie beef soup wish much onion big fan onions tacos goooood write home tell everyone good good remind kind tacos make home box craptastic like come honestly liked cornbread dry mom said baked potato pizza looked old touch unno one service another thing man assuming owner always kept talking even mom said something along lines wanting enjoy meals thanked hospitatlity damn shut felt like wanted sit talk shop us meet talk one another always refilled drinks cleared plates away quickly got keeep star fellow yelpers area want fresh salads might place especially want eat outside cafe style nice clean patio furniture want nice cozy bowl several like soup decent bread sticks place hit spot might need shoo away owner though order get privacy enjoy people arrive
So disappointed in this place.  I come here a lot but it's going down hill. Now I ask them to turn the tv to the game I want to watch and they said no.  No one is watching this tv but me!  I'm leaving and done with Loose Caboose.,1,disappointed place come lot going hill ask turn tv game want watch said one watching tv leaving done loose caboose
"After a long wait (-1 star) our food was not cold, but not hot (-1 star), but good tasting and expected portion sizes. Server gave me a good recommendation. I called ahead to confirm they were open for a 2pm lunch yet the dining room with the golf course view was closed and they were only serving in the cafe (-1 star).  Our server disappeared (he later said he went on a break) and the check never came and I had to go to the bar to investigate.

Sometimes restaurants in hotels aren't the best. I won't be back.",2,long wait star food cold hot star good tasting expected portion sizes server gave good recommendation called ahead confirm open lunch yet dining room golf course view closed serving cafe star server disappeared later said went break check never came go bar investigate sometimes restaurants hotels best wo back
"Went with a friend last night and picked Tatum's because it was walking distance from her condo and we wanted a golf course view.  Sat on the patio and it was nice.  Ordered the french onion soup - bland, and the stuffed mushrooms which were good.   For our meal we ordered the prime rib sandwhich and the philly sandwich - one with tater tots and the other with cajun fries.  We send both our dishes back TWICE because the sandwiches were cold.  It was obvious that they just tried to microwave them because the meat came back very tough and leathery:-(  The waitress had the executive chef take care of it, in which when they came back the plates were hot as well as the food.  Both meals were just ok..I have had better sandwiches at Portillo's.  Fries and tots were nothing special - pretty sure the tots are frozen ones that they just microwave - hence the amount of ketchup needed to eat them.  Waitress was very nice through all of this.  My friend works at a restaurant and I grew up in the grocery and restaurant business - were we too critical?  No, Tatum's needs to work on their menu and their cooking.  Glad we did not order the pricey entrees.",2,went friend last night picked tatum walking distance condo wanted golf course view sat patio nice ordered french onion soup bland stuffed mushrooms good meal ordered prime rib sandwhich philly sandwich one tater tots cajun fries send dishes back twice sandwiches cold obvious tried microwave meat came back tough leathery waitress executive chef take care came back plates hot well food meals ok better sandwiches portillo fries tots nothing special pretty sure tots frozen ones microwave hence amount ketchup needed eat waitress nice friend works restaurant grew grocery restaurant business critical tatum needs work menu cooking glad order pricey entrees
"I stepped into breakfast omelette counter but there's no whole eggs left. How hard is that to drive 2 min to buy from sprouts? 
I set down my Lipton hot tea and a cup holding my cooked spinach and chopped mushrooms on top of precooked chopped onion. When I returned from fruit section, I couldn't locate my two cups, so I dug into trash cans to locate cooked spinach without hot tea.
Of course, it's no big deal, I enjoyed conversations with Love..from Lo....na even I taught them what Dept of Health taught me while I bought lunch for him.  Splinkle",1,stepped breakfast omelette counter whole eggs left hard drive min buy sprouts set lipton hot tea cup holding cooked spinach chopped mushrooms top precooked chopped onion returned fruit section could locate two cups dug trash cans locate cooked spinach without hot tea course big deal enjoyed conversations love lo na even taught dept health taught bought lunch splinkle
"Atmosphere is cool, staff was friendly and attentive.  I ordered the Rueben, which was a mistake.  Although tasty, it was almost all fat and grizzle. I really struggled to finish it, but was so hungry after a long day of travel that I just pretended to be a lion on the serengeti and took it down.  Would not eat there again, but a good place for drinks.",2,atmosphere cool staff friendly attentive ordered rueben mistake although tasty almost fat grizzle really struggled finish hungry long day travel pretended lion serengeti took would eat good place drinks
"Picked this based on the two reviews. Its been 45 minutes since we saw our server. No appetizers yet. There are two servers and six tables. We have watched two orders go back to the chef, worried about our food. Food came, recommend burgers or sandwiches.",1,picked based two reviews minutes since saw server appetizers yet two servers six tables watched two orders go back chef worried food food came recommend burgers sandwiches
"Tried breakfast, lunch, and dinner here, and the food was terrible.  The only nice features are the friendly dinner staff and the nice golf course view during the day.  Since those two features can be easily obtained elsewhere, I would not recommend this place.

Breakfast- the eggs and sausages were fine, but the oatmeal was overcooked, and service was completely lacking despite the fact that the restaurant was not even half full.  

Steak salad- ordered the steak medium rare.  It came overly smoked, completely overcooked, and tasted like beef jerky.  The spinach was also not fresh.

Vegetable soup- tasted fine, but nothing special. 

Chicken Caesar- the dressing was fine, but the lettuce was somewhat blackened.  The chicken was also blackened and overcooked.  

Tater Tots- tasted fine, although a bit dry.  

Overall, this is at best a two star restaurant.",1,tried breakfast lunch dinner food terrible nice features friendly dinner staff nice golf course view day since two features easily obtained elsewhere would recommend place eggs sausages fine oatmeal overcooked service completely lacking despite fact restaurant even half full steak ordered steak medium rare came overly smoked completely overcooked tasted like beef jerky spinach also fresh vegetable tasted fine nothing special chicken dressing fine lettuce somewhat blackened chicken also blackened overcooked tater tasted fine although bit dry overall best two star restaurant
"The dirty table should have been a red flag. Went to the ""All You Can Eat"" fish fry...one serving was all I could eat. Never was given my tarter sauce or slaw...even AFTER I requested it. My granddaughter ordered the childrens spaghetti...she got bowtie pasta topped with salsa. Gulp...sorry...I threw up a little. The lettuce wraps had some surprises beneath the chunks of red onion...DRIED CHERRIES WEREN'T EVEN ON THE MENU! Really a sad deal...and no MANAGER to complain to...even the waiter was embarassed. I should have know when I watched him scarf a burger from Wendy's on his break. They only charged me for the fish...still waiting for the Sprite my grandchild ordered...hope they deliver! For a great Fish Friday...hit the TEXAZ grill on Bethany and 16th street.",1,dirty table red flag went eat fish fry one serving could eat never given tarter sauce slaw even requested granddaughter ordered childrens spaghetti got bowtie pasta topped salsa gulp sorry threw little lettuce wraps surprises beneath chunks red onion dried cherries even menu really sad deal manager complain even waiter embarassed know watched scarf burger wendy break charged fish still waiting sprite grandchild ordered hope deliver great fish friday hit texaz grill bethany street
"The red room and accompanying lounge are very nice spaces, with a darker modern decor, it's a great place to hang out and have a drink, but you should go somewhere else for food. The menu reads nicely but the execution is a bit clumsy, and the service takes years. 

so grab a couch a libation, and hang out, just dont open that menu",2,red room accompanying lounge nice spaces darker modern decor great place hang drink go somewhere else food menu reads nicely execution bit clumsy service takes years grab couch libation hang dont open menu
"Ducked into this place while waiting for a table at Abay around the corner.  

$25 for a glass of House Red  and a Kettle One tonic.  Where are we - NYC - LA?? ? 

Not to mention  - the waitstaff practically made me beg for it!   Waited for close to 10 min then had to stalk /chase one of the 2 bartenders to the other side of the bar.    The kicker is..... the bar had like 10 empty tables and the bar seating was 1/2 full!!!! 

Hahahahahahahahaha


1st  - time you get me - shame on you.... 
2nd-  time.... shame on me... 

Won't be a second time....  and that's unfortunate cause it looks like it has potential.  ()based off of other reviews here - maybe I overstated its potential!!)

Not to mention  - in a shady (not shadyside - and can't even justify those prices there), if not the shadiest part of town.",1,ducked place waiting table abay around corner glass house red kettle one tonic nyc la mention waitstaff practically made beg waited close min stalk one bartenders side bar kicker bar like empty tables bar seating full hahahahahahahahaha time get shame time shame wo second time unfortunate cause looks like potential based reviews maybe overstated potential mention shady shadyside ca even justify prices shadiest part town
"came here for a triple birthday and the only thing i liked about this place was that a lot of my friends were there. i know it's supposed to be more up-scale but shit, this place is still in east lib territory where i can get cheaper drinks at kelly's bar and shadow (including a cover). i waited for 10 mins to order a drink even though there was barely anyone at the bar and 3 bartenders. i can get quicker service at phi bar at its fullest capacity with one bartender.",2,came triple birthday thing liked place lot friends know supposed shit place still east lib territory get cheaper drinks kelly bar shadow including cover waited mins order drink even though barely anyone bar bartenders get quicker service phi bar fullest capacity one bartender
"Hard to figure this place out.  It has a surprisingly hip decor for Pittsburgh, which seems trapped either in some smoky dive bar nightmare or early 80s design.  Despite the design and relatively attentive service I do have complaints.  There are flat screen tvs everywhere!  Can i find a nice bar in this stupid town w/o 10 tvs playing sports? Also, to ruin the night they had one guy poorly playing covers on an electric guitar, what was the point of that?

The drinks were good but the food there is terrible and overpriced.  I'd go there for drinks if there was no musician and they turned the damn televisions off!

It has potential, just needs some tweeking. 2.5 stars",2,hard figure place surprisingly hip decor pittsburgh seems trapped either smoky dive bar nightmare early design despite design relatively attentive service complaints flat screen tvs everywhere find nice bar stupid town tvs playing sports also ruin night one guy poorly playing covers electric guitar point drinks good food terrible overpriced go drinks musician turned damn televisions potential needs tweeking stars
"This business has closed, and judging by the ""sheriff's sale"" postings, it will not be reopening... 

Gone is the pleasure of the proprietors and waitstaff x-raying your wallet and checking how expensive your shoes look as you enter, that is, if they pay you any attention at all. No more sitting drinkless as the only customers during ""happy"" hour, while the owner shmoozes a liquor vendor (a woman who repeatedly used the word ""zing-fen-dale,"" no joke) in the comfy lounge seats next to you. 

Someone needs to get the message: upscale (real or imagined) is not the only way to succeed on the developing East Liberty/Shadyside edge, no matter how desperately the Red Rooms and Richard Chens of the world may think so. Also, Pittsburgh can support only so many ersatz upscale restaurants, thank god. 

Good riddance, Red Room...",2,business closed judging sheriff sale postings reopening gone pleasure proprietors waitstaff wallet checking expensive shoes look enter pay attention sitting drinkless customers happy hour owner shmoozes liquor vendor woman repeatedly used word joke comfy lounge seats next someone needs get message upscale real imagined way succeed developing east edge matter desperately red rooms richard chens world may think also pittsburgh support many ersatz upscale restaurants thank god good riddance red room
"I really wanted to like this place.  I really did.  But the high prices, snooty wait staff and completely wrong-headed ""creativity"" of the chef (wrong-headed combinations of flavors) just turned me off.",1,really wanted like place really high prices snooty wait staff completely creativity chef combinations flavors turned
"iI just visited the LJS restaurant in New Kensington on Nov. 8, 2012 after not having visited it in awhile and was hungry for the fish & hush puppies.  I could not get over
how dirty the floor in the dining area was with paper and bits of garbage under almost all the tables.  It looks like it has't been swept in awhile.  There was a broom and dust pan leaning up against the pop machine & I was tempted to use it myself to sweep up.  I think it will sure be a long while before I visit that location again.",1,ii visited ljs restaurant new kensington visited awhile hungry fish hush puppies could get dirty floor dining area paper bits garbage almost tables looks like swept awhile broom dust pan leaning pop machine tempted use sweep think sure long visit location
"Dirty, mismanaged. People behind counter can't seem to keep the simplest order straight.",1,dirty mismanaged people behind counter ca seem keep simplest order straight
"Absolutely terrible. Less than mediocre. I ordered in advance and they hadn't made it when I got there. The people who work there are also rude. Even though they made it ""fresh,"" my shawarma was cold and gross. The falafel were like rocks. Do not eat here. I think Amir's is much better.",1,absolutely terrible less mediocre ordered advance made got people work also rude even though made fresh shawarma cold gross falafel like rocks eat think amir much better
"un drole de gout chimique
assiette trop couteuse
peu de légumes 
pire resto libanais que j'ai gouté",1,un drole de gout chimique assiette trop couteuse peu de légumes pire resto libanais que gouté
"So, its Friday night and we decide to drive 40 miles to try Lone Star.  I asked my daughter to call and see if she can get us a reservation since I hate to wait.  She made the call and was told that we didnt need a reservation and ""they would take care of us when we got there"".  Okay?   When we walked in to the Lone Star there was 3 or 4 couples waiting to be seated and I was told it would be 15 minutes.  I asked if they accepted reservations and was told ""only for 6 or more people"".  How nice.  

We were seated about 15 minutes later and promptly waited on.  The server had no expression, no personality, no nothing....  Like a robot.  

Our food was average and best and very salty.  It was nothing special and the bill was about $75.00 for two adults and two teenage girls.   

We will not be returning....",2,friday night decide drive miles try lone star asked daughter call see get us reservation since hate wait made call told didnt need reservation would take care us got okay walked lone star couples waiting seated told would minutes asked accepted reservations told people nice seated minutes later promptly waited server expression personality nothing like robot food average best salty nothing special bill two adults two teenage girls returning
"Boy is the name a temptation.Seriously :)  I'll try to be fair though but I'm writing at a time were this restaurant was truly life changing. So much so that I'm buying a dining room table, additional gear for the kitchen and not frequenting any chain while I'm in my hometown based on the strength of this experience. Even in a good mood this place wouldn't be breaking a 2.5 . I'm not in a good mood.  

Texas cheese fries. Pretty tasteless,mess of uncrisp steak fries that are meant to be Monterrey jack , cheddar and bacon. Either the cheese mixed itself together really well or that's not what I had. Bacon , mm that is a very generous term for the toe nail clippings of meat that ended up atop it. Saving grace was only ordering 1/2 an order.

Kid's meal.  Holy crap dried and scraggly carrots accompanied the most basic hot dog imaginable on the most generic bun. No refill offered this time on drink, no straw either.   By far the most cynical  kid's meal I've met. Sure make a profit but don't take the piss!  Fresh carrots are not hard to do , with white film on them.. sorry you've just earned a  1 star. Should have walked out, didn't. :( 

Entrees.

Cajun steak . Claims to be marinated in spices that I couldn't find. They may indeed have shown them a picture of the process in the recipe but I couldn't find it. Meant to be medium rare but was medium on one side , rare on the other, close though:) 

Sirloin steak. Cooked as requested , a bit over seasoned. 

Sides: Twice baked potato.  If you ever want to open up a salt mine these guy will do it for you. You want an idea of what it's texture was?  Twice chewed would be a better name. Warm vomit with bacon bits would be  a slightly more colorful, and chunky, term.

Fried onions:   came with whatever was stuck to the grill they came from.The mushrooms were the only thing that were as tasteful as expected. They looked very consistent though,  canned?   Never mind they were edible: 

Steak soup,really more a stew,but tasted pretty good.  Overall service was ok'ish but walking the kid to the toilet twice the staff just seemed  to want to get to where they wanted to go and not care for the toddler walking up the aisle to the restroom in front of me.  ( that's for this occasion only , past two times it's been great fun for the kid,)

1.5 rounded to 1 for the carrots.",1,boy name try fair though writing time restaurant truly life changing much buying dining room table additional gear kitchen frequenting chain hometown based strength experience even good mood place would breaking good mood texas cheese fries pretty tasteless mess uncrisp steak fries meant monterrey jack cheddar bacon either cheese mixed together really well bacon mm generous term toe nail clippings meat ended atop saving grace ordering order kid meal holy crap dried scraggly carrots accompanied basic hot dog imaginable generic bun refill offered time drink straw either far cynical kid meal met sure make profit take piss fresh carrots hard white film sorry earned star walked entrees cajun steak claims marinated spices could find may indeed shown picture process recipe could find meant medium rare medium one side rare close though sirloin steak cooked requested bit seasoned sides twice baked potato ever want open salt mine guy want idea texture twice chewed would better name warm vomit bacon bits would slightly colorful chunky term fried onions came whatever stuck grill came mushrooms thing tasteful expected looked consistent though canned never mind edible steak soup really stew tasted pretty good overall service walking kid toilet twice staff seemed want get wanted go care toddler walking aisle restroom front occasion past two times great fun kid rounded carrots
"Grade: D

Nice place. Nasty, overpriced food. Dopey but hot servers.",2,grade nice place nasty overpriced food dopey hot servers
"it was restaurant week. we read over the menu & loved it. i called & left a message for a reservation. No one returned my call by the next afternoon, so i called again. i spoke with a man that said he was so sorry, but they had had a gas leak & ended up closed for a few days. we made reservations for tues., the 23rd at 6pm. he had my name  & #.
we live in the s. hills, they're in etna. tom left work early so he could come home & shower. we left & fought through rush hour traffic in 2 directions. we pulled up across the street from it, trying to find it. finally, we saw it, dark! dark, dark, dark!!! my hubby went to the door. there was a note saying, sorry, we're closed still from a gas leak & frozen pipes! WHAT??? we just drove all the way over here, for nothing?! they didn't even have the decency to call us! 
NOT a good thing at all! i didn't want to give them any stars, but i had to, so they just get 1.",1,restaurant week read menu loved called left message reservation one returned call next afternoon called spoke man said sorry gas leak ended closed days made reservations name live hills etna tom left work early could come home shower left fought rush hour traffic directions pulled across street trying find finally saw dark dark dark dark hubby went door note saying sorry closed still gas leak frozen pipes drove way nothing even decency call us good thing want give stars get
