text,rating,cleaned_review
"I visited Dish 1st week of September. The one thing I realized about this place was how overpriced everything was. Breakfast burrito - $9? Grilled chicken that was laying out in the deli  (no sauce or condiments) $8? There is another place like Dish that sells the exact same chicken for $5. I order the pizza at the restaurant and it was a really salty. I should have just went to Domino's.

I really had a hard time believing the prices they are charging for a grilled sandwich (almost $10) to pasta. Are you kidding me? Then I realized I'm in Scottsdale where people will eat anything in front of them as long as that place looks trendy (see Olive and Ivy). 

The concept is pretty good. You can pick up stuff for home if you don't have time to make anything. I think the prices are restaurant prices for a take out place. 

I think the location of Dish will attract considerable traffic. It's a huge place that offers pick up and a sit down restaurant. Most of the employees knew what they were talking about and were friendly. But, it's vastly overpriced for what they offer.

Update 9/12/07: People have said that the food is pricey, but it's Scottsdale...so it comes with the territory. That's what's wrong with most people. Location should not justify the prices, the food should. Actually, I don't mind spending money if the food is worth it (in fact, my favorite local seafood restaurant is Wildfish, not inexpensive). 

But, the food is alright compared to the prices. If you're a bit lazy and can't make a sandwich yourself at home, then by all means..spend $10+ for a sandwich here.  I think this is definitely catering to the right crowd.  This place is a larger, overpriced LGO with marginal food. I've tried the pizza, grilled chicken sandwich, burrito, and sushi. All were OK.  Perhaps, I am fortunate that my client/work pays whenever I go there. I think there are other places I would go to spend my OWN money.

I think Dish will do well because of it's location and because it is Scottsdale..where most people don't have a discerning taste bud.  

One positive thing I will say is that it's a quick, easy place to get a meal and the employees seem knowledgeable about what they sell. So, if you're not in the mood to cook or even sure what to eat, but want a myriad of overpriced choices then Dish is for you. 

Again, this is a personal opinion. I'm not trying to offend anyone.",2,visit dish week septemb one thing realiz thi place wa overpr everyth wa breakfast burrito grill chicken wa lay deli sauc condiment anoth place like dish sell exact chicken order pizza restaur wa realli salti went domino realli hard time believ price charg grill sandwich almost pasta kid realiz scottsdal peopl eat anyth front long place look trendi see oliv ivi concept pretti good pick stuff home time make anyth think price restaur price take place think locat dish attract consider traffic huge place offer pick sit restaur employe knew talk friendli vastli overpr offer updat peopl said food pricey scottsdal come territori wrong peopl locat justifi price food actual mind spend money food worth fact favorit local seafood restaur wildfish inexpens food alright compar price bit lazi ca make sandwich home mean spend sandwich think thi definit cater right crowd thi place larger overpr lgo margin food tri pizza grill chicken sandwich burrito sushi perhap fortun pay whenev go think place would go spend money think dish well becaus locat becaus scottsdal peopl discern tast bud one posit thing say quick easi place get meal employe seem knowledg sell mood cook even sure eat want myriad overpr choic dish thi person opinion tri offend anyon
"I give them a 2 not a 1 because they actually had the best ribs ever!. They were over priced and the corn bread and various other things had trans fat in it. I confronted the president to alert them of my finding. 
I told them I saw it listed in the ingredients on the corn bread. 
Then questioned why have a bakery and have fresh baked bread when your using the ingredients of a sit on the shelf forever and not go bad bread?

She wrote back and told me they called the chef and they dont use it. 
WTF?
Its on the ingredients on the package, you idiot.
She didnt even know what was in the food so she told me a lie.

Weird, they didnt even make a lot of the stuff there. Thats why she didnt know",2,give becaus actual best rib ever price corn bread variou thing tran fat confront presid alert find told saw list ingredi corn bread question whi bakeri fresh bake bread use ingredi sit shelf forev go bad bread wrote back told call chef dont use wtf ingredi packag idiot didnt even know wa food told lie weird didnt even make lot stuff whi didnt know
"Too bad this restaurant couldn't work out all of the kinks I pointed out in my original review. Sadly, I saw Dish closing 6 months ago.",2,bad thi restaur could work kink point origin review sadli saw dish close month ago
"Chase G.? That's a big ole fail on you. 240 N. Sunway in Gilbert is, in fact, a tire store. Thanks for ruining my lunch small dancing rodent!!",1,chase big ole fail sunway gilbert fact tire store thank ruin lunch small danc rodent
"I so wanted to like this place.  Stopped in on a Thursday night, giddy with dessert excitement.  It took awhile for someone to acknowledge us and take our order.  The waitstaff seemed stressed, annoyed, and inexperienced.  But at this point I'm still thinking it's all going to be worth it.  What a disappointment.  The desserts we tried were bland and dry.  I tend to like things that aren't overly sweet, so it's not that I was expecting an explosion of sweetness and flavor, but I was expecting *some* flavor.  Especially for the price!  Maybe they have something worth eating, but I'm not going to waste any more of my time or money to find out.  The one plus - the water must be filtered because it was actually drinkable.",1,want like thi place stop thursday night giddi dessert excit took awhil someon acknowledg u take order waitstaff seem stress annoy inexperienc thi point still think go worth disappoint dessert tri bland dri tend like thing overli sweet wa expect explos sweet flavor wa expect flavor especi price mayb someth worth eat go wast ani time money find one plu water must filter becaus wa actual drinkabl
"I've always wondered about this place and finally tried it out with a friend who has been before.

To begin, you should be coming here with a truckstop diner mentality. Don't expect a hipstery brunch joint serving chorizo bennies with a side of duck fat avocado fries (oh man, i don't know if that's even a thing but i want it to be now!) This is a truckstop diner in all its glory. Large portions, probably oversalted food, very efficient service (truckstop servers are my favourite for this reason), retro diner ambience (but not forced retro), and neverending coffee.

I got the chicken fried steak with mashed potatoes, gravy, and steamed veg. Very salty, even for a sodiumphile like myself. Also tried the pierogies and sausage which were alright, as well as the hamburger steak.

Probably a great option for those lazy weekend mornings when you feel like going out for a huge, greasy, breakfast but don't want to line up with everyone else for the newest, cool, brunch place. +1 for credit card pay phones at some tables and the wall of stuffed husky toy animals at the front.",2,alway wonder thi place final tri friend ha befor begin come truckstop diner mental expect hipsteri brunch joint serv chorizo benni side duck fat avocado fri oh man know even thing want thi truckstop diner glori larg portion probabl oversalt food veri effici servic truckstop server favourit thi reason retro diner ambienc forc retro neverend coffe got chicken fri steak mash potato gravi steam veg veri salti even sodiumphil like also tri pierogi sausag alright well hamburg steak probabl great option lazi weekend morn feel like go huge greasi breakfast want line everyon el newest cool brunch place credit card pay phone tabl wall stuf huski toy anim front
The Cleveland Grill has sadly gone out of business.,1,cleveland grill ha sadli gone busi
Service is good 6 oz steak plain and tiny the size of a golf ball not worth the 23 bucks,1,servic good oz steak plain tini size golf ball worth buck
"While John's (our server) performance was impeccable, I doubt we'll be returning any time soon. My crab cake was VERY fishy tasting and Tuesday's only offered a very blah cocktail sauce - no teriyaki, soy or other flavor masker. My bride's chicken fresco was noticeably dry and her favorite vegetable, steamed broccoli, was not warm enough to melt the ""butter"" that John served after being asked for it. Her mashed cauliflower (which she couldn't bring herself to insist I try) was ""not quite what I remember"".

We didn't partake of the salad bar ... it was nicely presented but compared to Dessey's or a Sizzler it was seriously lacking.

Bottom line, if we get another ($10 max) 2 for 1 coupon we might return for a (see previous ratings) highly rated turkey burger. On the other hand, In-N-Out  is hard to resist when it come to burgers.

BTW, I'm glad we didn't take the (5 & 13) kids with us. There was nothing that would have appealed to them on the menu and we'd have had to stop at McDonald's to feed them later.",2,john server perform wa impecc doubt return ani time soon crab cake wa veri fishi tast tuesday onli offer veri blah cocktail sauc teriyaki soy flavor masker bride chicken fresco wa notic dri favorit veget steam broccoli wa warm enough melt butter john serv ask mash cauliflow could bring insist tri wa quit rememb partak salad bar wa nice present compar dessey sizzler wa serious lack bottom line get anoth max coupon might return see previou rate highli rate turkey burger hand hard resist come burger btw glad take kid u wa noth would appeal menu stop mcdonald feed later
"I don't know what is up with this Ruby's. I have had very good experiences at other locations but from now on I avoid this one. 

The server never came back to check on us, I asked for my burger medium rare and it was well done, and the waiter kept making weird comments to people at our table. For the price of the meal I would have been better off staying home and wouldn't have had to put up with such awful service.",1,know thi rubi veri good experi locat avoid thi one server never came back check u ask burger medium rare wa well done waiter kept make weird comment peopl tabl price meal would better stay home would put aw servic
"My girlfriend wanted to eat here since we've seen the commercials down in So Cal. Now I have eaten at a Ruby Tuesday before in Cleveland, OH, and I thought this one would be the same as its midwestern counterpart. Wow, this Ruby Tuesday was completely different. From the outside it looked like a Cocos or Sizzler. The Ruby Tuesday in Cleveland looked and felt like an upscale Chilis but with a better menu. They even had Stella Artois (my favorite beer) on tap!

The service here was okay at best, but the food was disappointing, especially after having an amazing experience at another RT. If you want to eat at a Ruby Tuesday, you might as well go to one in the midwest. Stay away from this one.",2,girlfriend want eat sinc seen commerci cal eaten rubi tuesday befor cleveland oh thought thi one would midwestern counterpart wow thi rubi tuesday wa complet differ outsid look like coco sizzler rubi tuesday cleveland look felt like upscal chili better menu even stella artoi favorit beer tap servic wa okay best food wa disappoint especi amaz experi anoth rt want eat rubi tuesday might well go one midwest stay away thi one
"Food was awful, the restaurant was filthy (Health Department should be involved), bugs crawling around ankles and human feces around the toilet.",1,food wa aw restaur wa filthi health depart involv bug crawl around ankl human fece around toilet
"Went in with a restaurant.com certificate. Was told it was no good on Fridays. Told waitress there was no date restriction on the certificate. She said they would accept it but I had to spend $50, not the $35 stated on the certificate. She said the manager changed the rules and it wouldn't  help to talk to him. A lady at the next table waved her certificate, she had the same problem. If the owner contracts with restaurant.com to sell discounted certificates, he should honor the contract!  We left never to return.",1,went certif wa told wa good friday told waitress wa date restrict certif said would accept spend state certif said manag chang rule would help talk ladi next tabl wave certif problem owner contract sell discount certif honor contract left never return
"I went here for the first time with a group of people and we all tried different items, the only items that were good were the mussels. Everything else was poor over priced food. Stay away!!!",1,went first time group peopl tri differ item onli item good mussel everyth el wa poor price food stay away
"Absolutely the worst experience I've ever had at a restaurant. Went in with a restaurant.com certificate, and after we had ordered our food, the waitress tells us that the certificate was no good because the manager made a mistake with the gift certificate and we would have to pay full price. I asked to see the manager and the waitress started yelling at me, saying that was the policy and the manager was not available.  I was astounded because: A) this was the restaurants fault and I should not be punished for their ineptitude and B) the waitress ended up yelling at me when I had simply asked to see the manager.  

As this was by far the worst service I have ever seen at any establishment, I did not leave a tip which which resulted in the waitress chasing me into the parking lot yelling obscenities at me. 

Aside from this incident, the food was mediocre and overpriced, and I would not return there even without the debacle.  Stay away.",1,absolut worst experi ever restaur went certif order food waitress tell u certif wa good becaus manag made mistak gift certif would pay full price ask see manag waitress start yell say wa polici manag wa avail wa astound becaus thi wa restaur fault punish ineptitud b waitress end yell simpli ask see manag thi wa far worst servic ever seen ani establish leav tip result waitress chase park lot yell obscen asid thi incid food wa mediocr overpr would return even without debacl stay away
"I am not in the habit of dissing restaurants. However, I owe it to the unsuspecting to do so now. Bathroom:filthy. Service: waited an hour for food. Quality:oysters were not edible--set them aside and ate the overlooked shrimp and fries.",1,habit dis restaur howev owe unsuspect bathroom filthi servic wait hour food qualiti oyster edibl set asid ate overlook shrimp fri
No stars. Lobby and outside disgusting. Kitchen door open to outside and no screens to keep flies out. Was looking forward to some good seafood....ugh.,1,star lobbi outsid disgust kitchen door open outsid screen keep fli wa look forward good seafood ugh
Terrible service.  Awful food do not eat here. Awful on both counts. Just terrible. I had to beg for service. The food took forever and was almost inedible. Do not eat here. Then the obnoxious trivia game began. I could not get out fast enough,1,terribl servic aw food eat aw count terribl beg servic food took forev wa almost ined eat obnoxi trivia game began could get fast enough
"The food is horrible; It's all frozen processed food and way over priced ($14+ for a dinner entree). I gave a two star rating because it is mainly a bar, and that aspect of the place isn't as bad. It's a dive-like bar, but they pour strong drinks.",2,food horribl frozen process food way price dinner entre gave two star rate becaus mainli bar aspect place bad bar strong drink
"This place is a joke. I went for oysters since I just started getting into them and I have to admit, this is the worst place for them. I ordered a few to try and tried to order something else off the menu but when I tried, it was like EVERYTHING was unavailable at the moment. How can you make money if you have nothing to sell? Ended up with 6 oysters and a burger. Waste of time and money.",1,thi place joke went oyster sinc start get admit thi worst place order tri tri order someth el menu tri wa like everyth wa unavail moment make money noth sell end oyster burger wast time money
"I was excited about trying this place but didn't even make it inside.  The outside area smells like an ash tray and is filthy.  There's a pot right outside the door filled with cigarette butts.   When I opened the door, the entry way was as bad, if not, worse than the outside.  It wreaked of cigarettes and filthy.  We turned around and left right away.  Let me know when the place is cleaned and I may be back.",1,wa excit tri thi place even make insid outsid area smell like ash tray filthi pot right outsid door fill cigarett butt open door entri way wa bad wors outsid wreak cigarett filthi turn around left right away let know place clean may back
"Saw this place and decided to give it a try but didn't make it past the front door.  There were cigarette butts all over the side walk,. We opened the door to a little room/ entryway area  and it smelled terrible like mildew, plus it was extremely dirty. For us that was a deal breaker and made us wonder what their kitchen must  look like.",1,saw thi place decid give tri make past front door cigarett butt side walk open door littl entryway area smell terribl like mildew plu wa extrem dirti u wa deal breaker made u wonder kitchen must look like
Their batter is way too heavy for the sesame beef and general tao chicken. As if they used too much corn starch maybe? In both cases you get these hard lumps that are partially air filled and barely have chicken/beef inside. The sauce for both is also way too sweet. The sweet sugary taste overwhelms any other taste. Shrimps in lobster sauce were extremely salty. It was overall just quite disappointing.,1,batter way heavi sesam beef gener tao chicken use much corn starch mayb case get hard lump partial air fill bare insid sauc also way sweet sweet sugari tast overwhelm ani tast shrimp lobster sauc extrem salti wa overal quit disappoint
"Health nuts (and those looking for lighter fare) will love that the food is free of heavy seasonings. But the portions are tiny and, my God, is the service here slow and rude. Perhaps that's why Sushi San, despite occupying one of the most visible spots in the food court, attracts hardly any customers even during peak hours. Once I asked for rice and vegetables in separate containers (as opposed to one on top of the other in a cramped bowl, making it impossible to enjoy the two together). The server flatout refused without even a trivial apology.",2,health nut look lighter fare love food free heavi season portion tini god servic slow rude perhap whi sushi san despit occupi one visibl spot food court attract hardli ani custom even dure peak hour onc ask rice veget separ contain oppos one top cramp bowl make imposs enjoy two togeth server flatout refus without even trivial apolog
"The Good:
SO and I both ordered Unagi bowls. The unagi itself was good, and that's the only reason I gave this two stars instead of one. 
The Bad:
The veggies served with it were not great, and it did not come with miso soup, unlike all of their other ""bowls"". Also, it took an extremely long time to receive our relatively simple meals, around fifteen-twenty minutes. This was because he completely forgot about us and only remembered when my SO went up and to ask about the food. Moreover, he and I watched as the worker (probably also the manager) argued with a customer, saying that she had already received her food, when it was clear it was a different girl who happened to order the same item. 

Overall, would not return, especially with Sushi Ichiban so close, and with more reasonable prices.",2,good order unagi bowl unagi wa good onli reason gave thi two star instead one bad veggi serv great come miso soup unlik bowl also took extrem long time receiv rel simpl meal around minut thi wa becaus complet forgot u onli rememb went ask food moreov watch worker probabl also manag argu custom say alreadi receiv food wa clear wa differ girl happen order item overal would return especi sushi ichiban close reason price
"this was not yummy or freshish or really ok. but if you insist on a california roll and happen to be trapped in the illini union at the time, how bad could it be?",1,thi wa yummi freshish realli insist california roll happen trap illini union time bad could
"I did not enjoy my experience here. My boyfriend and I were kind of excited to see that their nachos come topped with bacon. When the waitress (finally) came by to ask how everything was, I asked her if there was supposed to be bacon and she simply said ""yes it's small"".. it was just lackluster service and food quality.

It's a get-what-you-pay-for experience, I guess. It's close to the Bell Centre, but so are other places that will have better food and service. The only thing I really liked was that you can have free popcorn... that's pretty fun :)",2,enjoy experi boyfriend kind excit see nacho come top bacon waitress final came ask everyth wa ask wa suppos bacon simpli said ye small wa lacklust servic food qualiti experi guess close bell centr place better food servic onli thing realli like wa free popcorn pretti fun
"It's a sports bar, but that doesn't mean the staff have to be half-a**ed and not give a s**t.

Our server was rude right up to the point where my girlfriend spoke French. It's Montreal, don't pretend like this is the first time you've had people speaking English. This is located in a touristy area (Bell Centre, Train Station nearby...).

The nachos are supposed to have bacon on them. Ours didn't seem to have any, so we asked. We shouldn't have bothered asking - we were treated like idiots for asking. We eventually found a few crumbs of bacon. Don't describe the dish on the menu with bacon then have brush us off because we couldn't find any.

Scratch that - we found two chips with hints of bacon.

Thanks for the free popcorn...that was the highlight. 

Again, this is just a sports bar and not a good one. Go elsewhere. This place gets business because it is a chain and has a notable name. 

I guess the beer was cold...they got that right.",1,sport bar doe mean staff ed give server wa rude right point girlfriend spoke french montreal pretend like thi first time peopl speak english thi locat touristi area bell centr train station nearbi nacho suppos bacon seem ani ask bother ask treat like idiot ask eventu found crumb bacon describ dish menu bacon brush u becaus could find ani scratch found two chip hint bacon thank free popcorn wa highlight thi sport bar good one go elsewher thi place get busi becaus chain ha notabl name guess beer wa cold got right
"The Cage aux Sports is to Quebec - what Hooters is to the Southern US. They are everywhere, the menu is the same and they are boring.

I had gone for lunch and wanted to order the hot-chicken sandwich. Was politely told by the waitress that they didn't have any bread to make the sandwich. HUH? I'm no chef, but when I suggested that they substitute it for a hamburger bun and that I would be happy with that - she said the cook won't want to switch.

So I ordered a burger because they had a new menu with some ""specialty"" burgers. The patty was not fresh - it was the variety that you take from the freezer. Probably with grill marks already produced on them. It was not an enjoyable meal. 

A friend of mine had the grilled chicken wrap - commented that it was alright also.

Another friend of mine had the roasted chicken breast - said it was great, nice and moist chicken.

Just goes to prove to you - stick with the old.",2,cage sport quebec hooter southern u everywher menu bore gone lunch want order sandwich wa polit told waitress ani bread make sandwich huh chef suggest substitut hamburg bun would happi said cook wo want switch order burger becaus new menu specialti burger patti wa fresh wa varieti take freezer probabl grill mark alreadi produc wa enjoy meal friend mine grill chicken wrap comment wa alright also anoth friend mine roast chicken breast said wa great nice moist chicken goe prove stick old
