text,rating,cleaned_review
"I decided to try Marvellous Edibles because of the rave review the first reviewer gave it, and because it is in my neighborhood of Leaside. I've always driven past it and wondered what it was like, but since she gave it such a great review, I thought I'd give it a go. 

The restaurant has a sort of Parisian cafe feel to it, with mismatched chairs and some booths and tables, and a mural on the wall. Upon arrival mid-Saturday afternoon, we were also presented with 3 menus, breakfast (which was ending shortly), sandwiches and another menu which appeared to be dinner options, priced $16 - $24 range. My friend and I both selected from the sandwich menu. 

I ordered the BLT, but having noticed that they served peameal bacon for breakfast, asked if I could have peameal on my BLT, they obliged, no problem. My friend ordered the meat loaf sandwich and we both ordered the sweet potato fries. 

Service was fast, there were only 2 other occupied tables in the restaurant. I was expecting an average sandwich, didn't really figure you can screw up a BLT, er...thought wrong. The peameal was overcooked, and very dry, and it was served on 'white' bread, no egg or challah bread to be found here!! I was disappointed. The whole sandwich was dry, I asked for mayo, and the waiter said there was already mayo on it, I opened it up and the thing was bare. I showed him, and said, ""Umm, actually there's not..."" (awkward...) 

My friend's meatloaf sandwich was a mess!! First she had asked for no onions, was allergic to them, and upon receiving the sandwich, had to proceed to pick off somewhere in the range of 7-8 pieces of red onion off of her sandwich!! The problem with the sandwich was just that it was a complete mess. It was on a regular bun, and gravy was poured over the meatloaf and the other half of the bun was placed on top. On service, the bottom part of the bun, is soaked, drenched in gravy, making it impossible to pick up! It was just a mess, I think it would be a much more successful item choice if perhaps it was served as an open faced meat loaf sandwich, with the gravy in a boat on the side that you pour on yourself at the time you are going to eat it, so that the bottom bun doesn't disintegrate. 

As if our food quality wasn't bad enough while we were attempting to salvage a meal out of it, our entertainment was listening to our waiter bicker with the other waitress about table assignment and allocation of tips and how unfair she had been. The disagreement got quite heated and their voices were raised, creating quite a bit of tension in the restaurant amongst the customers, or at least, that was my perception. 

Overall, I was not impressed with the food or the service of this restaurant. I would not recommend it. I will not be returning to try their breakfast or brunch, or even to give it a second chance. Unfortunately, that was my very first and last visit. You know what they say, you never get a second chance to make a first impression.",1,decided try marvellous edibles rave review first reviewer gave neighborhood leaside always driven past wondered like since gave great review thought give go restaurant sort parisian cafe feel mismatched chairs booths tables mural wall upon arrival afternoon also presented menus breakfast ending shortly sandwiches another menu appeared dinner options priced range friend selected sandwich menu ordered blt noticed served peameal bacon breakfast asked could peameal blt obliged problem friend ordered meat loaf sandwich ordered sweet potato fries service fast occupied tables restaurant expecting average sandwich really figure screw blt er thought wrong peameal overcooked dry served bread egg challah bread found disappointed whole sandwich dry asked mayo waiter said already mayo opened thing bare showed said umm actually awkward friend meatloaf sandwich mess first asked onions allergic upon receiving sandwich proceed pick somewhere range pieces red onion sandwich problem sandwich complete mess regular bun gravy poured meatloaf half bun placed top service bottom part bun soaked drenched gravy making impossible pick mess think would much successful item choice perhaps served open faced meat loaf sandwich gravy boat side pour time going eat bottom bun disintegrate food quality bad enough attempting salvage meal entertainment listening waiter bicker waitress table assignment allocation tips unfair disagreement got quite heated voices raised creating quite bit tension restaurant amongst customers least perception overall impressed food service restaurant would recommend returning try breakfast brunch even give second chance unfortunately first last visit know say never get second chance make first impression
Came back into town after I moved out of state for a few years. We ordered the normal chicken salad with house dressing and chicken wings seasoned and to be honest. It was nothing like it used to be. The fries were dried out. Dressing was all paste. And the chicken wings didn't seem completely done. It's a shame bc I used to love this place. It def turned my taste buds to go elsewhere though. Hopefully it changes next time I visit!,2,came back town moved state years ordered normal chicken salad house dressing chicken wings seasoned honest nothing like used fries dried dressing paste chicken wings seem completely done shame bc used love place def turned taste buds go elsewhere though hopefully changes next time visit
"Stopped in to order a White pizza after shopping. Do I did not order ahead. First time there, wasn't a menu posted to see what options were... Ordered the White pizza almost 30 minute wait and was unimpressed with the pizza. Thin and no flavor.",1,stopped order white pizza shopping order ahead first time menu posted see options ordered white pizza almost minute wait unimpressed pizza thin flavor
"This is a great place for drinks and bar food if you don't mind the stench of cigarette smoke. Don't expect to escape the foul smell by sitting in the ""non-smoking"" dining area, separated by doors used by bar patrons to use the bathroom. 
I'll never know why any business owner would cater to the filthy, unhealthy habits of a few and risk losing the business of 76% of the population that do not smoke.",2,great place drinks bar food mind stench cigarette smoke expect escape foul smell sitting dining area separated doors used bar patrons use bathroom never know business owner would cater filthy unhealthy habits risk losing business population smoke
Bad customer service and rude employees. Unfriendly atmosphere. The young girl serving me looked disgusted to work there and was purely throwing the food on the plate! Not going back,1,bad customer service rude employees unfriendly atmosphere young girl serving looked disgusted work purely throwing food plate going back
"Where do I start, with the fact that this Mexican restaurant is owned by non mexicans or that the flavorless food is probably what they know as Mexican I don't know but I and everybody in my family were disapointed to say the least I ordered steak fajitas which is a Tex Mex dish FYI and it was horrible this are supposed to be grilled but not here they were boiled and this is a big no. The burrito my friend ordered was awful also so was the service with a waitress that try to speak Spanish to us with no luck at all which was weird because she had a Portuguese accent and both languages are alike anyways my advice go to Don Tequilas us just a couple blocks down.",1,start fact mexican restaurant owned non mexicans flavorless food probably know mexican know everybody family disapointed say least ordered steak fajitas tex mex dish fyi horrible supposed grilled boiled big burrito friend ordered awful also service waitress try speak spanish us luck weird portuguese accent languages alike anyways advice go tequilas us couple blocks
"Absolument inadmissible qu il n'y ait pas la possibilité de payer avec une carte de débit ou de crédit à cet établissement....Réveillez-vous ! On est en 2019 ! Aujourd'hui, la plupart des transactions se font en ligne. À moins que ça fasse bien votre affaire d'être payé en argent comptant...",1,absolument inadmissible qu il n ait pas la possibilité de payer avec une carte de débit ou de crédit à cet établissement est en la plupart des transactions se font en ligne à moins que ça fasse bien votre affaire payé en argent comptant
"Consider this place a mid flight refueling station between the downtown nightclubs and a night in jail somewhere in the Heights lol

Definitely not a place for the faint hearted. I usually frequent the place late hours(2:00am-4:00am crazy huh?). The food is typical greasy spoon but good. The gyros are really good too. They buzz you to the restrooms through a locked door at the top of the stairs(apparently to control the vagrant piss population). They are conveniently located in an abyss of a catacomb basement piss trough(it may be better to wet your pants and stay alive than to chance it...) 

OH! ....and be sure to tip the local hustlers waiting outside. Cheap insurance and a distraction for a clean get away!",2,consider place mid flight refueling station downtown nightclubs night jail somewhere heights lol definitely place faint hearted usually frequent place late hours crazy huh food typical greasy spoon good gyros really good buzz restrooms locked door top stairs apparently control vagrant piss population conveniently located abyss catacomb basement piss trough may better wet pants stay alive chance oh sure tip local hustlers waiting outside cheap insurance distraction clean get away
I waited a hour and 30 min. They game my food away to females that walked in 20 min after me and placed a order. Food was not what it was the first time I went,2,waited hour min game food away females walked min placed order food first time went
This was my go to spot but tonight I got cold food and when I told them that it was they argued me down and ask what I wanted to do I said I would prefer some hot food told the guy my fries was cold on my polish boys he took the fries off and made some fresh ones and put them on a cold polish boy with soggy bread I took them and said I will never visit this establishment again but I will say the woman who works in the morning is awesome she always prepares hot food sorry she had to lose a loyal customer.,2,go spot tonight got cold food told argued ask wanted said would prefer hot food told guy fries cold polish boys took fries made fresh ones put cold polish boy soggy bread took said never visit establishment say woman works morning awesome always prepares hot food sorry lose loyal customer
I went into the restaurant like normal a few weeks back and I saw a girl go in the back and the light skinned cook with freckles disappeared no one noticed me I went to the window and his pants was down to his ankles and she was standing in front of him he was playing with himself and I said hey what the fuck is going on they both jumped and apologize to me but what took the cake he went to take some food off the grill without washing his hands I'm so disgusted I'll never eat there again,1,went restaurant like normal weeks back saw girl go back light skinned cook freckles disappeared one noticed went window pants ankles standing front playing said hey fuck going jumped apologize took cake went take food grill without washing hands disgusted never eat
"When we arrived it took our waitress considerable time to bring us 2 diet cokes let alone even take our order. She kept walking by us and saying that she would be right with us, however it took her 20 minutes of backing and forthing to actually get to us and the restaurant wasn't even that busy later on a sunday evening. We decided to order calamari with tomato sauce. It was brought out in 35 minutes without tomato sauce. After asking for the tomato sauce, it took another 10 minutes to get it. But I have to say the calamari was probably the only decent thing about this night. We got our food shortly after. I ordered the goat cheese ravioli with smoked salmon. I'm 99% sure that there was little to no goat cheese in my ravioli as it had the taste and texture of ricotta cheese...something you'd pick up frozen at the grocery store. I also had to search for any pieces of smoked salmon as they were miniscule and few and far between. Overall, I've had store bought pasta much better than that. My boyfriend ordered the New York striploin which was supposed to come with tempura onion rings...there were none to be seen. The cut of the steak was completely wrong and the whole middle of the steak was all gristle. He also asked for sauce on the side and his steak was completely coated in it. It was disgusting and I actually felt bad watching him eat it and try to cut the thing. We then sat for 20 minutes waiting for the waitress to clear our plates and give us our bill. She would walk by us continuously and ignore us. We had a coupon for the restaurant which is another reason why we decided to try it, and both waitresses tried to short change us on the value of it, finally after telling them 3 times what needed to be done, they got it right.The service here was atrocious, the food was seriously lacking, especially for the price, the atmosphere was alright however it was freezing because it was cold and drafty.I'd never waste my time going here again and would warn other people about going there. I have no idea how this restaurant is still surviving in today's marketplace.",1,arrived took waitress considerable time bring us diet cokes let alone even take order kept walking us saying would right us however took minutes backing forthing actually get us restaurant even busy later sunday evening decided order calamari tomato sauce brought minutes without tomato sauce asking tomato sauce took another minutes get say calamari probably decent thing night got food shortly ordered goat cheese ravioli smoked salmon sure little goat cheese ravioli taste texture ricotta cheese something pick frozen grocery store also search pieces smoked salmon miniscule far overall store bought pasta much better boyfriend ordered new york striploin supposed come tempura onion rings none seen cut steak completely wrong whole middle steak gristle also asked sauce side steak completely coated disgusting actually felt bad watching eat try cut thing sat minutes waiting waitress clear plates give us bill would walk us continuously ignore us coupon restaurant another reason decided try waitresses tried short change us value finally telling times needed done got service atrocious food seriously lacking especially price atmosphere alright however freezing cold never waste time going would warn people going idea restaurant still surviving today marketplace
"This was easily the worst dining experience I have ever had.
I reserved for four people on the Saturday before Mother's day at 7pm. When we arrived we were placed in the bar, with music so loud it made conversation virtually impossible. I asked the hostess about seating in the restaurant as I had reserved and she said it was full. She offered to move us to another table in the bar, ut it was closer to the live music and would have been even noisier.
We ordered some drinks and I was confronted with a bottle of beer, with no glass. There was nothing fine dining about the atmosphere or he service. It was a bar room experience at fine dining prices.
The food was the only thing left to rescue the evening and it was a disaster. I ordered the pork tenderloin which was so overcooked that I thought they has served a pork chop with the bone in. It was also flavorless and burnt. My dining companions also expressed great disappointment with their meals, using terms like flavorless, over-cooked and cold.
We quickly paid the bill and left to seek a more appropriate venue for dessert and coffee. By this time even Tim Horton's seemed appealing.
Avoid this restaurant. The only thing that is fine dining is the pricing.",1,easily worst dining experience ever reserved four people saturday mother day arrived placed bar music loud made conversation virtually impossible asked hostess seating restaurant reserved said full offered move us another table bar ut closer live music would even noisier ordered drinks confronted bottle beer glass nothing fine dining atmosphere service bar room experience fine dining prices food thing left rescue evening disaster ordered pork tenderloin overcooked thought served pork chop bone also flavorless burnt dining companions also expressed great disappointment meals using terms like flavorless cold quickly paid bill left seek appropriate venue dessert coffee time even tim horton seemed appealing avoid restaurant thing fine dining pricing
"I was definitely seeing a lot of red at the Red Martini!  I usually have a 3 strikes and you're out policy... If this were a baseball game, the Red Martini's winning streak would be in the negatives!

It was my high school English teacher's birthday and because she lives I'm the Durham Region we usually dine somewhere in Pickering or Ajax. It gets me out of Toronto once in awhile.  So I had made reservations for 7pm. When we arrived there were 2 occupied tables in the downstairs bar lounge.  We stood there for 5 minutes with no sign of any hostess or staff.  After what seemed like an eternal wait, the waitress appeared and she told us we could choose a table either upstairs or downstairs.  We opted for the upper level.

The Red Martini is a house-converted restaurant, similar to 22 Church Street Bistro across the street.  A co-worker told me that the 2 restaurant are owned by the same owner, however this is unconfirmed.  However I did spot a lot of similarities.

Once we chose our table, again we were left unattended and ignored for awhile. We quickly realized that the waitress who ""greeted"" us downstairs was the only staff in the front end for the entire restaurant. Strike 1 - understaffed.

My high school English teacher loves her white wine and she usually orders the house white.  Strike 2 - they were out of their house white.  This is a clear indication of poor restaurant management.  So we had no other choice than to order the next available white wine which was twice the cost.

We waited for our appetizer - no bread basket appeared - Strike 3 and you're out! 

We ordered and shared the Stuffed Portobello Mushroom Salad to start. This could've easily been THE best tasting salad I've ever had in my life. However, the minor neglect in detail made it second best.  The salad was a deconstructed-style salad. The grilled portobello mushrooms were delicious. The ""stuffing"" was made from imitation crab meat and eggs... So essentially it tasted like an egg salad.  It was also served with COLD naan bread... It would've been the perfect salad if they grilled the naan. We had requested that the appetizer come first and then our mains... However the server showed up 2 minutes into us digging into our salads, so we had to send her back to the kitchen and requested the food be kept warm.

My Coconut Tilapia was served with a spicy plum sauce, Bok Choy, red and yellow bell peppers and jasmine rice. When I first bit into the tilapia I was excited that the fish skin was so crisp... But I quickly realized that the crisp was not due to skillful culinary execution, but rather to a burnt fish... Parts of it were so burnt I started tasting charcoal!  Also, the ""coconut"" component of the dish was M.I.A.  This dish had so much potential.. *sigh*

I didn't try my teacher's Veggie Stir-Fry with Chicken but the feedback I got from her wad that the vegetables were cooked to a mush, and that the chicken was dry.  In their defense, the mush factor may have been a result of the dish being kept on a warming plate.

To finish we ordered a cappuccino, tea and marbled cheesecake.  The server came back up to inform me that they don't offer cappuccino... How do you not know that?  Its like she was a temp hired to tide over a quiet Sunday restaurant service.  So I settled for a coffee.  

The cheesecake was average, nothing spectacular.  

At the end of the day, the bill came to $105.  I will say that the portion sizes are generous and the food does have potential... However, the service aspect is going to need a complete facelift.  I had such high hopes for you Red Martini... I thought you'd be sizzling... But unfortunately the only thing that was red and sizzling about my experience at the Red Martini was my dress and the afterburn in my mouth from the spicy plum sauce!",2,definitely seeing lot red red martini usually strikes policy baseball game red martini winning streak would negatives high school english teacher birthday lives durham region usually dine somewhere pickering ajax gets toronto awhile made reservations arrived occupied tables downstairs bar lounge stood minutes sign hostess staff seemed like eternal wait waitress appeared told us could choose table either upstairs downstairs opted upper level red martini restaurant similar church street bistro across street told restaurant owned owner however unconfirmed however spot lot similarities chose table left unattended ignored awhile quickly realized waitress greeted us downstairs staff front end entire restaurant strike understaffed high school english teacher loves white wine usually orders house white strike house white clear indication poor restaurant management choice order next available white wine twice cost waited appetizer bread basket appeared strike ordered shared stuffed portobello mushroom salad start could easily best tasting salad ever life however minor neglect detail made second best salad salad grilled portobello mushrooms delicious stuffing made imitation crab meat eggs essentially tasted like egg salad also served cold naan bread would perfect salad grilled naan requested appetizer come first mains however server showed minutes us digging salads send back kitchen requested food kept warm coconut tilapia served spicy plum sauce bok choy red yellow bell peppers jasmine rice first bit tilapia excited fish skin crisp quickly realized crisp due skillful culinary execution rather burnt fish parts burnt started tasting charcoal also coconut component dish dish much potential sigh try teacher veggie chicken feedback got wad vegetables cooked mush chicken dry defense mush factor may result dish kept warming plate finish ordered cappuccino tea marbled cheesecake server came back inform offer cappuccino know like temp hired tide quiet sunday restaurant service settled coffee cheesecake average nothing spectacular end day bill came say portion sizes generous food potential however service aspect going need complete facelift high hopes red martini thought sizzling unfortunately thing red sizzling experience red martini dress afterburn mouth spicy plum sauce
"Restaurants and bars in the Flats seem to have trouble delivering good service.  We sat at the bar and ordered 2 beers.  The bartender asked if he wanted to open a tab.  Well, we sat there with empty glasses and she never asked us if we wanted to order more beer.  If I was the owner I'd kick her ass for not generating more revenue.  This is the second time I've had this happen to me at this place.  It was crowded on a Wednesday night but the buck stopped there...",2,restaurants bars flats seem trouble delivering good service sat bar ordered beers bartender asked wanted open tab well sat empty glasses never asked us wanted order beer owner kick ass generating revenue second time happen place crowded wednesday night buck stopped
Si Senor is not my favorite taco option. I got a steak taco and the bit of steak was so little my meat was about the size of a quarter. I could hardly believe how little meat I had.   I ate here because in the summer they have an outside food stand at the USX tower.  I remember being out of the taco that wanted.  So whenever a food venture is out of something that I want that immediately knocks off some starts for me.  The salsa options were great but I dare say Qdoba is better then this place.,2,si senor favorite taco option got steak taco bit steak little meat size quarter could hardly believe little meat ate summer outside food stand usx tower remember taco wanted whenever food venture something want immediately knocks starts salsa options great dare say qdoba better place
"The tacos were cold and the dude was sketchy.  I probably could have told this just by looking but I had gotten lost on my way to ginger's and was hungry.

At least it was cheap.",2,tacos cold dude sketchy probably could told looking gotten lost way ginger hungry least cheap
