text,rating,cleaned_review
"I decided to try Marvellous Edibles because of the rave review the first reviewer gave it, and because it is in my neighborhood of Leaside. I've always driven past it and wondered what it was like, but since she gave it such a great review, I thought I'd give it a go. 

The restaurant has a sort of Parisian cafe feel to it, with mismatched chairs and some booths and tables, and a mural on the wall. Upon arrival mid-Saturday afternoon, we were also presented with 3 menus, breakfast (which was ending shortly), sandwiches and another menu which appeared to be dinner options, priced $16 - $24 range. My friend and I both selected from the sandwich menu. 

I ordered the BLT, but having noticed that they served peameal bacon for breakfast, asked if I could have peameal on my BLT, they obliged, no problem. My friend ordered the meat loaf sandwich and we both ordered the sweet potato fries. 

Service was fast, there were only 2 other occupied tables in the restaurant. I was expecting an average sandwich, didn't really figure you can screw up a BLT, er...thought wrong. The peameal was overcooked, and very dry, and it was served on 'white' bread, no egg or challah bread to be found here!! I was disappointed. The whole sandwich was dry, I asked for mayo, and the waiter said there was already mayo on it, I opened it up and the thing was bare. I showed him, and said, ""Umm, actually there's not..."" (awkward...) 

My friend's meatloaf sandwich was a mess!! First she had asked for no onions, was allergic to them, and upon receiving the sandwich, had to proceed to pick off somewhere in the range of 7-8 pieces of red onion off of her sandwich!! The problem with the sandwich was just that it was a complete mess. It was on a regular bun, and gravy was poured over the meatloaf and the other half of the bun was placed on top. On service, the bottom part of the bun, is soaked, drenched in gravy, making it impossible to pick up! It was just a mess, I think it would be a much more successful item choice if perhaps it was served as an open faced meat loaf sandwich, with the gravy in a boat on the side that you pour on yourself at the time you are going to eat it, so that the bottom bun doesn't disintegrate. 

As if our food quality wasn't bad enough while we were attempting to salvage a meal out of it, our entertainment was listening to our waiter bicker with the other waitress about table assignment and allocation of tips and how unfair she had been. The disagreement got quite heated and their voices were raised, creating quite a bit of tension in the restaurant amongst the customers, or at least, that was my perception. 

Overall, I was not impressed with the food or the service of this restaurant. I would not recommend it. I will not be returning to try their breakfast or brunch, or even to give it a second chance. Unfortunately, that was my very first and last visit. You know what they say, you never get a second chance to make a first impression.",1,decid tri marvel edibl becaus rave review first review gave becaus neighborhood leasid alway driven past wonder wa like sinc gave great review thought give go restaur ha sort parisian cafe feel mismatch chair booth tabl mural wall upon arriv afternoon also present menu breakfast wa end shortli sandwich anoth menu appear dinner option price rang friend select sandwich menu order blt notic serv peameal bacon breakfast ask could peameal blt oblig problem friend order meat loaf sandwich order sweet potato fri servic wa fast onli occupi tabl restaur wa expect averag sandwich realli figur screw blt er thought wrong peameal wa overcook veri dri wa serv bread egg challah bread found wa disappoint whole sandwich wa dri ask mayo waiter said wa alreadi mayo open thing wa bare show said umm actual awkward friend meatloaf sandwich wa mess first ask onion wa allerg upon receiv sandwich proceed pick somewher rang piec red onion sandwich problem sandwich wa wa complet mess wa regular bun gravi wa meatloaf half bun wa place top servic bottom part bun soak drench gravi make imposs pick wa mess think would much success item choic perhap wa serv open face meat loaf sandwich gravi boat side time go eat bottom bun doe disintegr food qualiti wa bad enough attempt salvag meal entertain wa listen waiter bicker waitress tabl assign alloc tip unfair disagr got quit heat voic rais creat quit bit tension restaur amongst custom least wa percept overal wa impress food servic thi restaur would recommend return tri breakfast brunch even give second chanc unfortun wa veri first last visit know say never get second chanc make first impress
Came back into town after I moved out of state for a few years. We ordered the normal chicken salad with house dressing and chicken wings seasoned and to be honest. It was nothing like it used to be. The fries were dried out. Dressing was all paste. And the chicken wings didn't seem completely done. It's a shame bc I used to love this place. It def turned my taste buds to go elsewhere though. Hopefully it changes next time I visit!,2,came back town move state year order normal chicken salad hous dress chicken wing season honest wa noth like use fri dri dress wa past chicken wing seem complet done shame bc use love thi place def turn tast bud go elsewher though hope chang next time visit
"Stopped in to order a White pizza after shopping. Do I did not order ahead. First time there, wasn't a menu posted to see what options were... Ordered the White pizza almost 30 minute wait and was unimpressed with the pizza. Thin and no flavor.",1,stop order white pizza shop order ahead first time wa menu post see option order white pizza almost minut wait wa unimpress pizza thin flavor
"This is a great place for drinks and bar food if you don't mind the stench of cigarette smoke. Don't expect to escape the foul smell by sitting in the ""non-smoking"" dining area, separated by doors used by bar patrons to use the bathroom. 
I'll never know why any business owner would cater to the filthy, unhealthy habits of a few and risk losing the business of 76% of the population that do not smoke.",2,thi great place drink bar food mind stench cigarett smoke expect escap foul smell sit dine area separ door use bar patron use bathroom never know whi ani busi owner would cater filthi unhealthi habit risk lose busi popul smoke
Bad customer service and rude employees. Unfriendly atmosphere. The young girl serving me looked disgusted to work there and was purely throwing the food on the plate! Not going back,1,bad custom servic rude employe unfriendli atmospher young girl serv look disgust work wa pure throw food plate go back
"Where do I start, with the fact that this Mexican restaurant is owned by non mexicans or that the flavorless food is probably what they know as Mexican I don't know but I and everybody in my family were disapointed to say the least I ordered steak fajitas which is a Tex Mex dish FYI and it was horrible this are supposed to be grilled but not here they were boiled and this is a big no. The burrito my friend ordered was awful also so was the service with a waitress that try to speak Spanish to us with no luck at all which was weird because she had a Portuguese accent and both languages are alike anyways my advice go to Don Tequilas us just a couple blocks down.",1,start fact thi mexican restaur non mexican flavorless food probabl know mexican know everybodi famili disapoint say least order steak fajita tex mex dish fyi wa horribl thi suppos grill boil thi big burrito friend order wa aw also wa servic waitress tri speak spanish u luck wa weird becaus portugues accent languag alik anyway advic go tequila u coupl block
"Absolument inadmissible qu il n'y ait pas la possibilité de payer avec une carte de débit ou de crédit à cet établissement....Réveillez-vous ! On est en 2019 ! Aujourd'hui, la plupart des transactions se font en ligne. À moins que ça fasse bien votre affaire d'être payé en argent comptant...",1,absolu inadmiss pa possibilité payer cart débit crédit cet établiss plupart transact font lign moin ça fas bien votr affair payé argent comptant
"Consider this place a mid flight refueling station between the downtown nightclubs and a night in jail somewhere in the Heights lol

Definitely not a place for the faint hearted. I usually frequent the place late hours(2:00am-4:00am crazy huh?). The food is typical greasy spoon but good. The gyros are really good too. They buzz you to the restrooms through a locked door at the top of the stairs(apparently to control the vagrant piss population). They are conveniently located in an abyss of a catacomb basement piss trough(it may be better to wet your pants and stay alive than to chance it...) 

OH! ....and be sure to tip the local hustlers waiting outside. Cheap insurance and a distraction for a clean get away!",2,consid thi place mid flight refuel station downtown nightclub night jail somewher height lol definit place faint heart usual frequent place late hour crazi huh food typic greasi spoon good gyro realli good buzz restroom lock door top stair appar control vagrant piss popul conveni locat abyss catacomb basement piss trough may better wet pant stay aliv chanc oh sure tip local hustler wait outsid cheap insur distract clean get away
I waited a hour and 30 min. They game my food away to females that walked in 20 min after me and placed a order. Food was not what it was the first time I went,2,wait hour min game food away femal walk min place order food wa wa first time went
This was my go to spot but tonight I got cold food and when I told them that it was they argued me down and ask what I wanted to do I said I would prefer some hot food told the guy my fries was cold on my polish boys he took the fries off and made some fresh ones and put them on a cold polish boy with soggy bread I took them and said I will never visit this establishment again but I will say the woman who works in the morning is awesome she always prepares hot food sorry she had to lose a loyal customer.,2,thi wa go spot tonight got cold food told wa argu ask want said would prefer hot food told guy fri wa cold polish boy took fri made fresh one put cold polish boy soggi bread took said never visit thi establish say woman work morn awesom alway prepar hot food sorri lose loyal custom
I went into the restaurant like normal a few weeks back and I saw a girl go in the back and the light skinned cook with freckles disappeared no one noticed me I went to the window and his pants was down to his ankles and she was standing in front of him he was playing with himself and I said hey what the fuck is going on they both jumped and apologize to me but what took the cake he went to take some food off the grill without washing his hands I'm so disgusted I'll never eat there again,1,went restaur like normal week back saw girl go back light skin cook freckl disappear one notic went window hi pant wa hi ankl wa stand front wa play said hey fuck go jump apolog took cake went take food grill without wash hi hand disgust never eat
"When we arrived it took our waitress considerable time to bring us 2 diet cokes let alone even take our order. She kept walking by us and saying that she would be right with us, however it took her 20 minutes of backing and forthing to actually get to us and the restaurant wasn't even that busy later on a sunday evening. We decided to order calamari with tomato sauce. It was brought out in 35 minutes without tomato sauce. After asking for the tomato sauce, it took another 10 minutes to get it. But I have to say the calamari was probably the only decent thing about this night. We got our food shortly after. I ordered the goat cheese ravioli with smoked salmon. I'm 99% sure that there was little to no goat cheese in my ravioli as it had the taste and texture of ricotta cheese...something you'd pick up frozen at the grocery store. I also had to search for any pieces of smoked salmon as they were miniscule and few and far between. Overall, I've had store bought pasta much better than that. My boyfriend ordered the New York striploin which was supposed to come with tempura onion rings...there were none to be seen. The cut of the steak was completely wrong and the whole middle of the steak was all gristle. He also asked for sauce on the side and his steak was completely coated in it. It was disgusting and I actually felt bad watching him eat it and try to cut the thing. We then sat for 20 minutes waiting for the waitress to clear our plates and give us our bill. She would walk by us continuously and ignore us. We had a coupon for the restaurant which is another reason why we decided to try it, and both waitresses tried to short change us on the value of it, finally after telling them 3 times what needed to be done, they got it right.The service here was atrocious, the food was seriously lacking, especially for the price, the atmosphere was alright however it was freezing because it was cold and drafty.I'd never waste my time going here again and would warn other people about going there. I have no idea how this restaurant is still surviving in today's marketplace.",1,arriv took waitress consider time bring u diet coke let alon even take order kept walk u say would right u howev took minut back forth actual get u restaur wa even busi later sunday even decid order calamari tomato sauc wa brought minut without tomato sauc ask tomato sauc took anoth minut get say calamari wa probabl onli decent thing thi night got food shortli order goat chees ravioli smoke salmon sure wa littl goat chees ravioli tast textur ricotta chees someth pick frozen groceri store also search ani piec smoke salmon miniscul far overal store bought pasta much better boyfriend order new york striploin wa suppos come tempura onion ring none seen cut steak wa complet wrong whole middl steak wa gristl also ask sauc side hi steak wa complet coat wa disgust actual felt bad watch eat tri cut thing sat minut wait waitress clear plate give u bill would walk u continu ignor u coupon restaur anoth reason whi decid tri waitress tri short chang u valu final tell time need done got servic wa atroci food wa serious lack especi price atmospher wa alright howev wa freez becaus wa cold never wast time go would warn peopl go idea thi restaur still surviv today marketplac
"This was easily the worst dining experience I have ever had.
I reserved for four people on the Saturday before Mother's day at 7pm. When we arrived we were placed in the bar, with music so loud it made conversation virtually impossible. I asked the hostess about seating in the restaurant as I had reserved and she said it was full. She offered to move us to another table in the bar, ut it was closer to the live music and would have been even noisier.
We ordered some drinks and I was confronted with a bottle of beer, with no glass. There was nothing fine dining about the atmosphere or he service. It was a bar room experience at fine dining prices.
The food was the only thing left to rescue the evening and it was a disaster. I ordered the pork tenderloin which was so overcooked that I thought they has served a pork chop with the bone in. It was also flavorless and burnt. My dining companions also expressed great disappointment with their meals, using terms like flavorless, over-cooked and cold.
We quickly paid the bill and left to seek a more appropriate venue for dessert and coffee. By this time even Tim Horton's seemed appealing.
Avoid this restaurant. The only thing that is fine dining is the pricing.",1,thi wa easili worst dine experi ever reserv four peopl saturday befor mother day arriv place bar music loud made convers virtual imposs ask hostess seat restaur reserv said wa full offer move u anoth tabl bar ut wa closer live music would even noisier order drink wa confront bottl beer glass wa noth fine dine atmospher servic wa bar room experi fine dine price food wa onli thing left rescu even wa disast order pork tenderloin wa overcook thought ha serv pork chop bone wa also flavorless burnt dine companion also express great disappoint meal use term like flavorless cold quickli paid bill left seek appropri venu dessert coffe thi time even tim horton seem appeal avoid thi restaur onli thing fine dine price
"I was definitely seeing a lot of red at the Red Martini!  I usually have a 3 strikes and you're out policy... If this were a baseball game, the Red Martini's winning streak would be in the negatives!

It was my high school English teacher's birthday and because she lives I'm the Durham Region we usually dine somewhere in Pickering or Ajax. It gets me out of Toronto once in awhile.  So I had made reservations for 7pm. When we arrived there were 2 occupied tables in the downstairs bar lounge.  We stood there for 5 minutes with no sign of any hostess or staff.  After what seemed like an eternal wait, the waitress appeared and she told us we could choose a table either upstairs or downstairs.  We opted for the upper level.

The Red Martini is a house-converted restaurant, similar to 22 Church Street Bistro across the street.  A co-worker told me that the 2 restaurant are owned by the same owner, however this is unconfirmed.  However I did spot a lot of similarities.

Once we chose our table, again we were left unattended and ignored for awhile. We quickly realized that the waitress who ""greeted"" us downstairs was the only staff in the front end for the entire restaurant. Strike 1 - understaffed.

My high school English teacher loves her white wine and she usually orders the house white.  Strike 2 - they were out of their house white.  This is a clear indication of poor restaurant management.  So we had no other choice than to order the next available white wine which was twice the cost.

We waited for our appetizer - no bread basket appeared - Strike 3 and you're out! 

We ordered and shared the Stuffed Portobello Mushroom Salad to start. This could've easily been THE best tasting salad I've ever had in my life. However, the minor neglect in detail made it second best.  The salad was a deconstructed-style salad. The grilled portobello mushrooms were delicious. The ""stuffing"" was made from imitation crab meat and eggs... So essentially it tasted like an egg salad.  It was also served with COLD naan bread... It would've been the perfect salad if they grilled the naan. We had requested that the appetizer come first and then our mains... However the server showed up 2 minutes into us digging into our salads, so we had to send her back to the kitchen and requested the food be kept warm.

My Coconut Tilapia was served with a spicy plum sauce, Bok Choy, red and yellow bell peppers and jasmine rice. When I first bit into the tilapia I was excited that the fish skin was so crisp... But I quickly realized that the crisp was not due to skillful culinary execution, but rather to a burnt fish... Parts of it were so burnt I started tasting charcoal!  Also, the ""coconut"" component of the dish was M.I.A.  This dish had so much potential.. *sigh*

I didn't try my teacher's Veggie Stir-Fry with Chicken but the feedback I got from her wad that the vegetables were cooked to a mush, and that the chicken was dry.  In their defense, the mush factor may have been a result of the dish being kept on a warming plate.

To finish we ordered a cappuccino, tea and marbled cheesecake.  The server came back up to inform me that they don't offer cappuccino... How do you not know that?  Its like she was a temp hired to tide over a quiet Sunday restaurant service.  So I settled for a coffee.  

The cheesecake was average, nothing spectacular.  

At the end of the day, the bill came to $105.  I will say that the portion sizes are generous and the food does have potential... However, the service aspect is going to need a complete facelift.  I had such high hopes for you Red Martini... I thought you'd be sizzling... But unfortunately the only thing that was red and sizzling about my experience at the Red Martini was my dress and the afterburn in my mouth from the spicy plum sauce!",2,wa definit see lot red red martini usual strike polici thi basebal game red martini win streak would neg wa high school english teacher birthday becaus live durham region usual dine somewher picker ajax get toronto onc awhil made reserv arriv occupi tabl downstair bar loung stood minut sign ani hostess staff seem like etern wait waitress appear told u could choos tabl either upstair downstair opt upper level red martini restaur similar church street bistro across street told restaur owner howev thi unconfirm howev spot lot similar onc chose tabl left unattend ignor awhil quickli realiz waitress greet u downstair wa onli staff front end entir restaur strike understaf high school english teacher love white wine usual order hous white strike hous white thi clear indic poor restaur manag choic order next avail white wine wa twice cost wait appet bread basket appear strike order share stuf portobello mushroom salad start thi could easili best tast salad ever life howev minor neglect detail made second best salad wa salad grill portobello mushroom delici stuf wa made imit crab meat egg essenti tast like egg salad wa also serv cold naan bread would perfect salad grill naan request appet come first main howev server show minut u dig salad send back kitchen request food kept warm coconut tilapia wa serv spici plum sauc bok choy red yellow bell pepper jasmin rice first bit tilapia wa excit fish skin wa crisp quickli realiz crisp wa due skill culinari execut rather burnt fish part burnt start tast charcoal also coconut compon dish wa thi dish much potenti sigh tri teacher veggi chicken feedback got wad veget cook mush chicken wa dri defens mush factor may result dish kept warm plate finish order cappuccino tea marbl cheesecak server came back inform offer cappuccino know like wa temp hire tide quiet sunday restaur servic settl coffe cheesecak wa averag noth spectacular end day bill came say portion size gener food doe potenti howev servic aspect go need complet facelift high hope red martini thought sizzl unfortun onli thing wa red sizzl experi red martini wa dress afterburn mouth spici plum sauc
"Restaurants and bars in the Flats seem to have trouble delivering good service.  We sat at the bar and ordered 2 beers.  The bartender asked if he wanted to open a tab.  Well, we sat there with empty glasses and she never asked us if we wanted to order more beer.  If I was the owner I'd kick her ass for not generating more revenue.  This is the second time I've had this happen to me at this place.  It was crowded on a Wednesday night but the buck stopped there...",2,restaur bar flat seem troubl deliv good servic sat bar order beer bartend ask want open tab well sat empti glass never ask u want order beer wa owner kick gener revenu thi second time thi happen thi place wa crowd wednesday night buck stop
Si Senor is not my favorite taco option. I got a steak taco and the bit of steak was so little my meat was about the size of a quarter. I could hardly believe how little meat I had.   I ate here because in the summer they have an outside food stand at the USX tower.  I remember being out of the taco that wanted.  So whenever a food venture is out of something that I want that immediately knocks off some starts for me.  The salsa options were great but I dare say Qdoba is better then this place.,2,si senor favorit taco option got steak taco bit steak wa littl meat wa size quarter could hardli believ littl meat ate becaus summer outsid food stand usx tower rememb taco want whenev food ventur someth want immedi knock start salsa option great dare say qdoba better thi place
"The tacos were cold and the dude was sketchy.  I probably could have told this just by looking but I had gotten lost on my way to ginger's and was hungry.

At least it was cheap.",2,taco cold dude wa sketchi probabl could told thi look gotten lost way ginger wa hungri least wa cheap
"Ick.  I don't think this classifies as Mexican.  I was mislead by the name but should have known better once I saw they offer wraps.  I figured they used the name wraps in place of burritos since... well... Pittsburgh is really unfamiliar with Mexican food.

I ordered the classic wrap which, according to the description, is your choice of protein, beans, cheese, rice, and choice of sauce stuffed in a tortilla.  I went with the shredded beef and chipotle sauce.  What I got ... well I can see why they referred to it as a wrap and not a burrito.  The tortilla was cold (what?) and the ""shredded beef"" was more like beef chunks.  The iceberg lettuce was an unwelcome surprise.  Black beans.... I hate black beans.  I guess it was wrong to assume they would be pinto or refried.  The chipotle sauce wasn't spicy at all and just added a burnt flavor.

Would never come back.  I can't believe I paid $7.20 for this wrap.  

If for some odd reason you want to try this place.... they do offer vegan / vegetarian options with grilled veggies and tofu as an option for your filling.

P.S. California, I miss you.",1,ick think thi classifi mexican wa mislead name known better onc saw offer wrap figur use name wrap place burrito sinc well pittsburgh realli unfamiliar mexican food order classic wrap accord descript choic protein bean chees rice choic sauc stuf tortilla went shred beef chipotl sauc got well see whi refer wrap burrito tortilla wa cold shred beef wa like beef chunk iceberg lettuc wa unwelcom surpris black bean hate black bean guess wa wrong assum would pinto refri chipotl sauc wa spici ad burnt flavor would never come back ca believ paid thi wrap odd reason want tri thi place offer vegan vegetarian option grill veggi tofu option fill california miss
