text,rating,cleaned_review
"Like another reviewer said, it does look like more from the outside.  When I walked in, it was actually a pretty shabby stand near the antique mall.  Prices weren't bad I guess, but the burgers were very blah as well as the fries.  Definitely are much much better places to get a good burger than here.  I'll give it one thing, it was all very fresh, as they didn't make it till we ordered it.  Maybe a decent eat if you happen to be shopping at the antique mall, but don't think we'll be coming back just for the food!",2,like anoth review said doe look like outsid walk wa actual pretti shabbi stand near antiqu mall price bad guess burger veri blah well fri definit much much better place get good burger give one thing wa veri fresh make till order mayb decent eat happen shop antiqu mall think come back food
"This place closed on April 30,2016. Guess it was killed by the dead
mall that surrounds it!",1,thi place close april guess wa kill dead mall surround
"Dear Mr. McGrath,

I recognize you are a talented award winning chef. I love the Roaring Fork. However, I am wholehaeartedly dissapointed in what you've done to Pischke's - its just not Pischke's anymore at all. Pischke's was a fun, friendly, unpretentious, comfort food joint. I loved hitting Pischke's for lunch after a NASTY hangover. The single BEST SALAD ON THE PLANET was the Blackened Cajun Ceaser Salad and now its gone. Old Pischke's would've gotten * * * * * five stars.

Now it's snobby and overpriced.

BOTTOM LINE: Bring back my salad or else!!",1,dear mcgrath recogn talent award win chef love roar fork howev wholehaeartedli dissapoint done pischk pischk anymor pischk wa fun friendli unpretenti comfort food joint love hit pischk lunch nasti hangov singl best salad planet wa blacken cajun ceaser salad gone old pischk would gotten five star snobbi overpr bottom line bring back salad el
"I was a little dissapointed with the new Pischke's. 

Admittedly I was never a huge fan of the original, so maybe I'm not the most qualified to post the first review. 

The menu was pretty limited. I had the mozzeralla and tomato sandwhich with soup. The soup was cold. The sandwhich was boring. 

Maybe I made a mistake by not going with the burger or pastrami sandwhich (both looked really good), but nothing I had made much of an impression. The service was nice, but overall the concept seemed pretty uninspired.",2,wa littl dissapoint new pischk admittedli wa never huge fan origin mayb qualifi post first review menu wa pretti limit mozzeralla tomato sandwhich soup soup wa cold sandwhich wa bore mayb made mistak go burger pastrami sandwhich look realli good noth made much impress servic wa nice overal concept seem pretti uninspir
"If it were not for the bloody mary and mimosa specials....there would be no reason to step foot in the new Pischkes (and still, I would rather go pay $7 for a mimosa where there is some atmosphere and good food. 

What a shame, this used to serve the best breakfast in town and have an hour wait....people enjoyed having a cocktail at the bar and running into friends....now, it is pretty much seat yourself and enjoy a limited menu.  HINT:  Mr. McGrath, bring back the old menu and food....I love the Roaring Fork and eat there twice a month, but this place used to be the best breakfast joint in town....bring back the old Pischke's please!!!!",1,bloodi mari mimosa special would reason step foot new pischk still would rather go pay mimosa atmospher good food shame thi use serv best breakfast town hour wait peopl enjoy cocktail bar run friend pretti much seat enjoy limit menu hint mcgrath bring back old menu food love roar fork eat twice month thi place use best breakfast joint town bring back old pischk plea
I can't this is still listed.  PLACE HAS BEEN OUT OF BUSINESS FOR A YEAR.,1,ca thi still list place ha busi year
"I must agree with Scott S, but I should point out that I'm probably even less qualified to write a review of this place as I didn't eat here... I merely wandered in and right back out. 

Gone is the crowd and the long wait on a weekend morning waiting for a Pischke's greasy and tasty breakfast. Gone is the kitschy decor that gave the place character. Gone are the sassy waitresses who looked like they needed a good night sleep. Gone are the bursting menus full of good eats at reasonable prices.

Replacing all of this is a bland and boring decor, 50% fewer menu choices, and 50% higher prices. The place was pretty empty while every other breakfast place in the neighborhood (we drove past 5 others) was packed with a line going out the door. Here's a tip for Mr Robert McGrath - if you buy a successful restaurant, don't make drastic changes and jack up the prices... in other words - if it ain't broke, don't fix it. 

I'm actually kinda pissed too because I thought Pischke's was pretty good and it was definitely adding character to our city... what's there now is just another boring restaurant. There's plenty of those around here... Pischke's was unique to the area. When I visit my sister in Minnesota, she has some really neat breakfast places she takes me to that are decorated as an eclectic mess, but that blow you away with good greasy food and are dripping with atmosphere and fun. Same story when I go to San Diego or Long Beach to visit friends. Neat hip cities have neat hip breakfast joints. Well now we have one fewer. 

It's true - I haven't eaten here and perhaps Robert McGrath makes the most bomb-ass bacon and eggs this side of the equator... but it would seriously have to blow my mind to put this place back on my list of places to go. The empty seats told me the story anyway. Before I left, I told the hostess to put it back the way it was. 

I plan to actually have a meal there sometime and then post a proper review... until then, this will have to do.",1,must agre scott point probabl even qualifi write review thi place eat mere wander right back gone crowd long wait weekend morn wait pischk greasi tasti breakfast gone kitschi decor gave place charact gone sassi waitress look like need good night sleep gone burst menu full good eat reason price replac thi bland bore decor fewer menu choic higher price place wa pretti empti everi breakfast place neighborhood drove past wa pack line go door tip mr robert mcgrath buy success restaur make drastic chang jack price word broke fix actual kinda piss becaus thought pischk wa pretti good wa definit ad charact citi anoth bore restaur plenti around pischk wa uniqu area visit sister minnesota ha realli neat breakfast place take decor eclect mess blow away good greasi food drip atmospher fun stori go san diego long beach visit friend neat hip citi neat hip breakfast joint well one fewer true eaten perhap robert mcgrath make bacon egg thi side equat would serious blow mind put thi place back list place go empti seat told stori anyway befor left told hostess put back way wa plan actual meal sometim post proper review thi
"Edit: Since I reviewed this place, it has become something else and I can no longer recommend it. I'll leave my original 4 star review in tact, but I'm taking away 2 of the stars to reflect the current state of the place - overpriced pretentiousness. I'm taking away one more star because they kept the name and ditched the no-brainer existing and working formula. My review of the new place is elsewhere here on Yelp. 

Here's my original review of the original restaurant - sad to see it gone:

Fantastic breakfasts - a little on the greasy side, but it's a neat little greasy spoon in old town Scottsdale. It belongs in Seattle or Minnesota really. It's certainly a favorable alternative to a breakfast at The Breakfast Club. The staff isn't quite as pretty (but so what?) and the food is a little bit more greasy (but it's oh so good). You don't have to get dressed up to go to breakfast like you do in some of the downtown scottsdale places which is nice. 

It beats going to Denny's and it's reliable for some good food... you can't go wrong here and the crowd is diverse and make for great people-watching. Sometimes it gets really busy, but the wait usually isn't too bad.",1,edit sinc review thi place ha becom someth el longer recommend leav origin star review tact take away star reflect current state place overpr pretenti take away one star becaus kept name ditch exist work formula review new place elsewher yelp origin review origin restaur sad see gone fantast breakfast littl greasi side neat littl greasi spoon old town scottsdal belong seattl minnesota realli certainli favor altern breakfast breakfast club staff quit pretti food littl bit greasi oh good get dress go breakfast like downtown scottsdal place nice beat go denni reliabl good food ca go wrong crowd diver make great sometim get realli busi wait usual bad
"This place was perfect before it was ""upgraded"". It was a simple, kitschy, affordable, little place that had heart. It was a Scottsdale legend... Tragedy struck the family recently. So. Instead of preserving what locals had come to love (obvious if you ever tried to eat here on the weekends), Mr. McGrath instead ""upgraded"" and turned a remarkable place into just another old town restaurant.

Don't me wrong, the Roaring Fork is genius... but this place was as well....",2,thi place wa perfect befor wa upgrad wa simpl kitschi afford littl place heart wa scottsdal legend tragedi struck famili recent instead preserv local come love obviou ever tri eat weekend mcgrath instead upgrad turn remark place anoth old town restaur wrong roar fork geniu thi place wa well
"Apparently Pischke's used to be a fun, personality-filled destination for yummy brunch, which is why my friend Aaron guided us there one early afternoon.

Unfortunately, since Aaron's last visit, changes have been made.

Now Pischke's is a bland eatery with a rather uninspired, limited menu positioned at the aspirational eating price point. As far as I can tell Pischke's target customer is well off older people who are looking for unchallenging options and prices high enough to keep out the riff raff.

Pischke's no longer serves daily brunch, so we had lunch on our visit. Among our group of six, not one of the dishes stood out in a positive way. The burger and salads were average. The crepes were decent but small and nothing special. The pork verde was fine, but inexplicably served with buttered flour tortillas. The pot pie was atrocious-- a ""deconstructed"" take on the typical comfort food it consisted of a large bowl filled with extremely bland pot pie filling, topped by a thin layer of philo dough flakes. It was devoid of everything (taste, crust) that makes a pot pie good.

The food was complimented by very poor service. Our waiter was totally smarmy and condescending, my drink order went unfilled, and when the food was served the waiter had coded the seats wrong so every single meal was placed in front of the wrong person.

Highly unimpressive. While Phoenix may not be known as a fine dining destination, there are plenty of great restaurants in the area to patronize instead. Don't waste your calories, time or money at Pischke's.",1,appar pischk use fun destin yummi brunch whi friend aaron guid u one earli afternoon unfortun sinc aaron last visit chang made pischk bland eateri rather uninspir limit menu posit aspir eat price point far tell pischk target custom well older peopl look unchalleng option price high enough keep riff raff pischk longer serv daili brunch lunch visit among group six one dish stood posit way burger salad averag crepe decent small noth special pork verd wa fine inexplic serv butter flour tortilla pot pie wa atroci deconstruct take typic comfort food consist larg bowl fill extrem bland pot pie fill top thin layer philo dough flake wa devoid everyth tast crust make pot pie good food wa compliment veri poor servic waiter wa total smarmi condescend drink order went unfil food wa serv waiter code seat wrong everi singl meal wa place front wrong person highli unimpress phoenix may known fine dine destin plenti great restaur area patron instead wast calori time money pischk
"Needs a new name - now.  

The Pischke's of old had such a sad ending.  I appreciated McGrath's effort to keep ""Pischke's"" alive.  But it is nothing, nothing, nothing like the Pischke's of old.  Call it ""The Blue Ribbon Cafe"" - take out the PIschke name - I can't imagine that Chris PIschke would have been honored to be remembered this way.  If his restaurant was a reflection of who he was as a person - Pischke's Blue Ribbon Cafe would be the exact opposite of who he was.  

The current restaurant is not a laid back, family friendly and yet a bar all at once restaurant that serves an unending array of crazy good sandwiches/salads/etc - the current decor is pretentious, and the food matches that.",1,need new name pischk old sad end appreci mcgrath effort keep pischk aliv noth noth noth like pischk old call blue ribbon cafe take pischk name ca imagin chri pischk would honor rememb thi way hi restaur wa reflect wa person pischk blue ribbon cafe would exact opposit wa current restaur laid back famili friendli yet bar onc restaur serv unend array crazi good current decor pretenti food match
"The new ""Pischke's Blue Ribbion"" is a cleaner, updated, reinvented ""Pischke's""... and it really blows! It is overpriced and boring!

There is NO POINT in keeping the ""Pischke's"" name on this place whatsoever! I know tragedy struck this place once, and now it has again, with the complete disembowelment of what ""Pischke's"" was all about! 

It was a Scottsdale ledgend, it was a chill place to grab breakfast and work on the ol' hangover, it was actually perfect the way it was...

Too bad.",2,new pischk blue ribbion cleaner updat reinvent pischk realli blow overpr bore point keep pischk name thi place whatsoev know tragedi struck thi place onc ha complet disembowel pischk wa wa scottsdal ledgend wa chill place grab breakfast work ol hangov wa actual perfect way wa bad
"I don't understand the reviews of the restaurant.  Either we were on an off day or this restaurant won't last another 30 days.  The food quality, service, management attentiveness was absolutley non-existent.  Some of the dishes could have been good if they were served hot and on time.  Service was horrendously slow and several of the dishes were inedible.  The Sea Bass was extremely salty, the Moroccan Chicken was cold and the medium rare lamb chops were well done.  
We complained to the servers repeatedly and to the management with no positive results.  Management appears brain dead.  They had two responses: ""We're sorry to hear that"" and ""We're utilizing a new concept"" .",1,understand review restaur either day thi restaur wo last anoth day food qualiti servic manag attent wa absolutley dish could good serv hot time servic wa horrend slow sever dish ined sea bass wa extrem salti moroccan chicken wa cold medium rare lamb chop well done complain server repeatedli manag posit result manag appear brain dead two respons sorri hear util new concept
"Yelp has failed me...I went here based on the reviews I found on here, only to find a restaurant that has fallen off from what it used to be. 

I guess this use to be a chef driven restaurant, he created a name for the place. But whatever it is now it has definitely fallen off and definitely not good. 

The space is nice enough, I really did not enjoy sitting at the bar and have to look at there dirty kitchen the whole time...But the place does offer a pleasant enough atmosphere. 

The food on the other hand was bad. I had the tasting of the appetizers in which everything was overcooked (mushy eggplant) or overcooked and Burnt (anything that had bread like potential) I kinda of wanted to leave after this but I had ordered my Salmon entree from the start... 

And now on to the entree which consisted of overcooked salmon, burnt spices on the top, and RAW skin underneath, did not make any since to me. it came with a brick of polenta edible only by the pool of sauce on the plate. 

The menu and idea of this restaurant is great, sharp contrasts and bold flavor, but the technique and care is definitely lack here, or maybe they just had a shitty cook that day, I don't know, I just know that I will never make my way back there.",2,yelp ha fail went base review found onli find restaur ha fallen use guess thi use chef driven restaur creat name place whatev ha definit fallen definit good space nice enough realli enjoy sit bar look dirti kitchen whole time place doe offer pleasant enough atmospher food hand wa bad tast appet everyth wa overcook mushi eggplant overcook burnt anyth bread like potenti kinda want leav thi order salmon entre start entre consist overcook salmon burnt spice top raw skin underneath make ani sinc came brick polenta edibl onli pool sauc plate menu idea thi restaur great sharp contrast bold flavor techniqu care definit lack mayb shitti cook day know know never make way back
"Hugely Disappointing!!  Based on all the other reviews maybe they were have an off night?  We already decided not to give it a 2nd try.....

We were seated and given menus but waited a good 10 minutes for them to come back for drink orders.  Then we waited a good 15 minutes for our dirty Kettle One martini's to come and waiting to order.  While we were waiting as patiently as we could the waiter takes the full order (drinks, apps, meal) of the couple who were seated 15 minutes after we arrived! Of course I would be understanding on the wait if the place was packed but there were only 5 tables filled in the entire place!!

We finally ordered and the watier came back 3 different times to clarify what we ordered.

The complimentary bread finally arrived along with our drinks, which by the way were terrible and in filthy (spotty, lipstick stained, crusty).  The bread was really great though so I started to have hope.

From the App's the Scallop and Goat cheese was great- the duck and mushroom was bland.

Main meal of pork chops and sea bass were boring. 

Oh when we got the bill they only did Well Martini's- would that have explained the poor taste or do they just not know how to make?

Bottom Line Summary:

Service Slow
Waiter Confused
Martini Horrible
Dirty Dirty Glasses
Food sounds GREAT but tastes quite bland.

Very Disappointing.",1,huge disappoint base review mayb night alreadi decid give tri seat given menu wait good minut come back drink order wait good minut dirti kettl one martini come wait order wait patient could waiter take full order drink app meal coupl seat minut arriv cours would understand wait place wa pack onli tabl fill entir place final order watier came back differ time clarifi order complimentari bread final arriv along drink way terribl filthi spotti lipstick stain crusti bread wa realli great though start hope app scallop goat chees wa duck mushroom wa bland main meal pork chop sea bass bore oh got bill onli well would explain poor tast know make bottom line summari servic slow waiter confus martini horribl dirti dirti glass food sound great tast quit bland veri disappoint
"Without a doubt the worst Chinese restaurant in Cleveland . The restaurant is located in an old McDonald's building barely fitted for a sit down restaurant.  

I ordered an egg roll - it was average - mustard and ketchup containers used for hot mustard and sweet and sour - cute. 

I ordered walnut chicken - a ""new"" menu item - it was horrible. I was expecting something fast fried in a brown sauce and stir fried with honey walnuts. What I received was a pile of ""white"" fried chicken with a flavorless sauce and some walnuts thrown in. It tasted like cornstarch -the sauce had absolutely no flavor - I would have added soy sauce, but I don't need the extra sodium and there might not have been enough in the restaurant to spice it up.   

The service was extremely friendly and very attentive - so much so that I couldn't bring myself to complain about the food.  I simply asked for a carryout container, boxed it up, and threw it out at my hotel.  

It was really cheap though - $15.00 for entree and egg roll.  I was on my expense account, so it didn't bother me to go somewhere else to eat that night.  

But do yourself a favor - this place is not good.  Ignore the internet reviews.  I can't believe that anything here has any flavor....",1,without doubt worst chine restaur cleveland restaur locat old mcdonald build bare fit sit restaur order egg roll wa averag mustard ketchup contain use hot mustard sweet sour cute order walnut chicken new menu item wa horribl wa expect someth fast fri brown sauc stir fri honey walnut receiv wa pile white fri chicken flavorless sauc walnut thrown tast like cornstarch sauc absolut flavor would ad soy sauc need extra sodium might enough restaur spice servic wa extrem friendli veri attent much could bring complain food simpli ask carryout contain box threw hotel wa realli cheap though entre egg roll wa expens account bother go somewher el eat night favor thi place good ignor internet review ca believ anyth ha ani flavor
"Not trying to rain on anyone's parade. There just aren't any choices here if you're vegetarian or vegan. Well. There's one. And you have to ask for no pork. And then the little guy (who was VERY nice by the way) asked if I ate no meat and when I said yes he said ""I'll ask them to cook it in water because there is beef in the broth."" ?? Okay. The sauce was super salty, not spicy like on the menu, and the tofu was very slimy. Anyway, it wasn't great. But I ate it.",2,tri rain anyon parad ani choic vegetarian vegan well one ask pork littl guy wa veri nice way ask ate meat said ye said ask cook water becaus beef broth okay sauc wa super salti spici like menu tofu wa veri slimi anyway wa great ate
"It's amazing how things can go so wrong.

On a 9 a.m. visit, the first thing I noticed was that this shop offers soups, sandwiches, and salads.  I wasn't in the mood for typical breakfast items. I asked the attendant whether they were serving sandwiches.  I even pointed to sandwiches on the menu.  No, he replied, only breakfast items (bacon, sausage, or ham and egg croissants or bagels).

You can't nuke a croissant.  My $4 croissant was no better than a cheap Jimmy Dean frozen sausage croissant from the grocery store. It came with coffee that was nothing special. I pumped the coffee from dispensers that ran dry.  You get better coffee from 7-Eleven.

I noticed servers standing around the soup and salad area.  Out of curiosity, I asked if they were serving soup and sandwiches.  Yes, they serve soup, salad, and sandwiches all day.

I asked the attendant who helped me at first.  ""I thought you said you weren't serving sandwiches.""
   ""Oh no.  We serve them all day!""

What can you do?  I spoke English and apparently he understood it.  What went wrong is anyone's guess.  My first experience here was highly negative.  It's a nice shop, however.  The attendant was friendly and pleasant. Maybe the misunderstanding was somehow all my fault.

Rather than buy anything here, pick up a cheap breakfast sandwich at the nearby Terrible's convenience store. 

Or, take your chances on their soups, sandwiches, and salads. There are pretty pictures all around the shop that make the offerings look tasty.",1,amaz thing go wrong visit first thing notic wa thi shop offer soup sandwich salad wa mood typic breakfast item ask attend whether serv sandwich even point sandwich menu repli onli breakfast item bacon sausag ham egg croissant bagel ca nuke croissant croissant wa better cheap jimmi dean frozen sausag croissant groceri store came coffe wa noth special pump coffe dispens ran dri get better coffe notic server stand around soup salad area curio ask serv soup sandwich ye serv soup salad sandwich day ask attend help first thought said serv sandwich oh serv day spoke english appar understood went wrong anyon guess first experi wa highli neg nice shop howev attend wa friendli pleasant mayb misunderstand wa somehow fault rather buy anyth pick cheap breakfast sandwich nearbi terribl conveni store take chanc soup sandwich salad pretti pictur around shop make offer look tasti
"sick...and not in the way my college roommate use to say ""that's sick! "" (meaning cool, awesome, sweet, wicked (variation of any of the previous). No this was just gross. 

After driving across town to two different malls to find a particular dress in my size, I worked up quite the appetite. Hey it's Friday- I'll go for some Americanized Asian...so I ordered the general Tso's with a maki roll ( not sushi- this is what they call their spring rolls), and noodles.

My noodles were cold...like really cold. The portion was beyond stingy- normally with these kind of take-out restaurants I cannot finish my meal, but their were exactly 11 pieces of chicken 7 of which were teeny-tiny bits... The texture of both meat and noodles was very mushy and overall not so tasty. When I paid with debit the girl at the counter literally handed my receipt and said ""sign-this"" ...so much for service. I will say it was cheap and the spring roll was edible. 

I should have known better than to give into mall food cravings...not worth the calories. But hey on a positive note I did find my dress size at CP Mall!",1,sick way colleg roommat use say sick mean cool awesom sweet wick variat ani previou thi wa gross drive across town two differ mall find particular dress size work quit appetit hey go american asian order gener tso maki roll thi call spring roll noodl noodl cold like realli cold portion wa beyond normal kind restaur finish meal exactli piec chicken bit textur meat noodl wa veri mushi overal tasti paid debit girl counter liter hand receipt said much servic say wa cheap spring roll wa edibl known better give mall food crave worth calori hey posit note find dress size cp mall
