text,rating,cleaned_review
"After a long wait (-1 star) our food was not cold, but not hot (-1 star), but good tasting and expected portion sizes. Server gave me a good recommendation. I called ahead to confirm they were open for a 2pm lunch yet the dining room with the golf course view was closed and they were only serving in the cafe (-1 star).  Our server disappeared (he later said he went on a break) and the check never came and I had to go to the bar to investigate.

Sometimes restaurants in hotels aren't the best. I won't be back.",2,long wait star food wa cold hot star good tast expect portion size server gave good recommend call ahead confirm open lunch yet dine room golf cours view wa close onli serv cafe star server disappear later said went break check never came go bar investig sometim restaur hotel best wo back
"Went with a friend last night and picked Tatum's because it was walking distance from her condo and we wanted a golf course view.  Sat on the patio and it was nice.  Ordered the french onion soup - bland, and the stuffed mushrooms which were good.   For our meal we ordered the prime rib sandwhich and the philly sandwich - one with tater tots and the other with cajun fries.  We send both our dishes back TWICE because the sandwiches were cold.  It was obvious that they just tried to microwave them because the meat came back very tough and leathery:-(  The waitress had the executive chef take care of it, in which when they came back the plates were hot as well as the food.  Both meals were just ok..I have had better sandwiches at Portillo's.  Fries and tots were nothing special - pretty sure the tots are frozen ones that they just microwave - hence the amount of ketchup needed to eat them.  Waitress was very nice through all of this.  My friend works at a restaurant and I grew up in the grocery and restaurant business - were we too critical?  No, Tatum's needs to work on their menu and their cooking.  Glad we did not order the pricey entrees.",2,went friend last night pick tatum becaus wa walk distanc condo want golf cours view sat patio wa nice order french onion soup bland stuf mushroom good meal order prime rib sandwhich philli sandwich one tater tot cajun fri send dish back twice becaus sandwich cold wa obviou tri microwav becaus meat came back veri tough leatheri waitress execut chef take care came back plate hot well food meal ok better sandwich portillo fri tot noth special pretti sure tot frozen one microwav henc amount ketchup need eat waitress wa veri nice thi friend work restaur grew groceri restaur busi critic tatum need work menu cook glad order pricey entre
"I stepped into breakfast omelette counter but there's no whole eggs left. How hard is that to drive 2 min to buy from sprouts? 
I set down my Lipton hot tea and a cup holding my cooked spinach and chopped mushrooms on top of precooked chopped onion. When I returned from fruit section, I couldn't locate my two cups, so I dug into trash cans to locate cooked spinach without hot tea.
Of course, it's no big deal, I enjoyed conversations with Love..from Lo....na even I taught them what Dept of Health taught me while I bought lunch for him.  Splinkle",1,step breakfast omelett counter whole egg left hard drive min buy sprout set lipton hot tea cup hold cook spinach chop mushroom top precook chop onion return fruit section could locat two cup dug trash locat cook spinach without hot tea cours big deal enjoy convers love lo na even taught dept health taught bought lunch splinkl
"Atmosphere is cool, staff was friendly and attentive.  I ordered the Rueben, which was a mistake.  Although tasty, it was almost all fat and grizzle. I really struggled to finish it, but was so hungry after a long day of travel that I just pretended to be a lion on the serengeti and took it down.  Would not eat there again, but a good place for drinks.",2,atmospher cool staff wa friendli attent order rueben wa mistak although tasti wa almost fat grizzl realli struggl finish wa hungri long day travel pretend lion serengeti took would eat good place drink
"Picked this based on the two reviews. Its been 45 minutes since we saw our server. No appetizers yet. There are two servers and six tables. We have watched two orders go back to the chef, worried about our food. Food came, recommend burgers or sandwiches.",1,pick thi base two review minut sinc saw server appet yet two server six tabl watch two order go back chef worri food food came recommend burger sandwich
"Tried breakfast, lunch, and dinner here, and the food was terrible.  The only nice features are the friendly dinner staff and the nice golf course view during the day.  Since those two features can be easily obtained elsewhere, I would not recommend this place.

Breakfast- the eggs and sausages were fine, but the oatmeal was overcooked, and service was completely lacking despite the fact that the restaurant was not even half full.  

Steak salad- ordered the steak medium rare.  It came overly smoked, completely overcooked, and tasted like beef jerky.  The spinach was also not fresh.

Vegetable soup- tasted fine, but nothing special. 

Chicken Caesar- the dressing was fine, but the lettuce was somewhat blackened.  The chicken was also blackened and overcooked.  

Tater Tots- tasted fine, although a bit dry.  

Overall, this is at best a two star restaurant.",1,tri breakfast lunch dinner food wa terribl onli nice featur friendli dinner staff nice golf cours view dure day sinc two featur easili obtain elsewher would recommend thi place egg sausag fine oatmeal wa overcook servic wa complet lack despit fact restaur wa even half full steak order steak medium rare came overli smoke complet overcook tast like beef jerki spinach wa also fresh veget tast fine noth special chicken dress wa fine lettuc wa somewhat blacken chicken wa also blacken overcook tater tast fine although bit dri overal thi best two star restaur
"The dirty table should have been a red flag. Went to the ""All You Can Eat"" fish fry...one serving was all I could eat. Never was given my tarter sauce or slaw...even AFTER I requested it. My granddaughter ordered the childrens spaghetti...she got bowtie pasta topped with salsa. Gulp...sorry...I threw up a little. The lettuce wraps had some surprises beneath the chunks of red onion...DRIED CHERRIES WEREN'T EVEN ON THE MENU! Really a sad deal...and no MANAGER to complain to...even the waiter was embarassed. I should have know when I watched him scarf a burger from Wendy's on his break. They only charged me for the fish...still waiting for the Sprite my grandchild ordered...hope they deliver! For a great Fish Friday...hit the TEXAZ grill on Bethany and 16th street.",1,dirti tabl red flag went eat fish fri one serv wa could eat never wa given tarter sauc slaw even request granddaught order child spaghetti got bowti pasta top salsa gulp sorri threw littl lettuc wrap surpris beneath chunk red onion dri cherri even menu realli sad deal manag complain even waiter wa embarass know watch scarf burger wendi hi break onli charg fish still wait sprite grandchild order hope deliv great fish friday hit texaz grill bethani street
"The red room and accompanying lounge are very nice spaces, with a darker modern decor, it's a great place to hang out and have a drink, but you should go somewhere else for food. The menu reads nicely but the execution is a bit clumsy, and the service takes years. 

so grab a couch a libation, and hang out, just dont open that menu",2,red room accompani loung veri nice space darker modern decor great place hang drink go somewher el food menu read nice execut bit clumsi servic take year grab couch libat hang dont open menu
"Ducked into this place while waiting for a table at Abay around the corner.  

$25 for a glass of House Red  and a Kettle One tonic.  Where are we - NYC - LA?? ? 

Not to mention  - the waitstaff practically made me beg for it!   Waited for close to 10 min then had to stalk /chase one of the 2 bartenders to the other side of the bar.    The kicker is..... the bar had like 10 empty tables and the bar seating was 1/2 full!!!! 

Hahahahahahahahaha


1st  - time you get me - shame on you.... 
2nd-  time.... shame on me... 

Won't be a second time....  and that's unfortunate cause it looks like it has potential.  ()based off of other reviews here - maybe I overstated its potential!!)

Not to mention  - in a shady (not shadyside - and can't even justify those prices there), if not the shadiest part of town.",1,duck thi place wait tabl abay around corner glass hous red kettl one tonic nyc mention waitstaff practic made beg wait close min stalk one bartend side bar kicker bar like empti tabl bar seat wa full hahahahahahahahaha time get shame time shame wo second time unfortun caus look like ha potenti base review mayb overst potenti mention shadi shadysid ca even justifi price shadiest part town
"came here for a triple birthday and the only thing i liked about this place was that a lot of my friends were there. i know it's supposed to be more up-scale but shit, this place is still in east lib territory where i can get cheaper drinks at kelly's bar and shadow (including a cover). i waited for 10 mins to order a drink even though there was barely anyone at the bar and 3 bartenders. i can get quicker service at phi bar at its fullest capacity with one bartender.",2,came tripl birthday onli thing like thi place wa lot friend know suppos shit thi place still east lib territori get cheaper drink kelli bar shadow includ cover wait min order drink even though wa bare anyon bar bartend get quicker servic phi bar fullest capac one bartend
"Hard to figure this place out.  It has a surprisingly hip decor for Pittsburgh, which seems trapped either in some smoky dive bar nightmare or early 80s design.  Despite the design and relatively attentive service I do have complaints.  There are flat screen tvs everywhere!  Can i find a nice bar in this stupid town w/o 10 tvs playing sports? Also, to ruin the night they had one guy poorly playing covers on an electric guitar, what was the point of that?

The drinks were good but the food there is terrible and overpriced.  I'd go there for drinks if there was no musician and they turned the damn televisions off!

It has potential, just needs some tweeking. 2.5 stars",2,hard figur thi place ha surprisingli hip decor pittsburgh seem trap either smoki dive bar nightmar earli design despit design rel attent servic complaint flat screen tv everywher find nice bar thi stupid town tv play sport also ruin night one guy poorli play cover electr guitar wa point drink good food terribl overpr go drink wa musician turn damn televis ha potenti need tweek star
"This business has closed, and judging by the ""sheriff's sale"" postings, it will not be reopening... 

Gone is the pleasure of the proprietors and waitstaff x-raying your wallet and checking how expensive your shoes look as you enter, that is, if they pay you any attention at all. No more sitting drinkless as the only customers during ""happy"" hour, while the owner shmoozes a liquor vendor (a woman who repeatedly used the word ""zing-fen-dale,"" no joke) in the comfy lounge seats next to you. 

Someone needs to get the message: upscale (real or imagined) is not the only way to succeed on the developing East Liberty/Shadyside edge, no matter how desperately the Red Rooms and Richard Chens of the world may think so. Also, Pittsburgh can support only so many ersatz upscale restaurants, thank god. 

Good riddance, Red Room...",2,thi busi ha close judg sheriff sale post reopen gone pleasur proprietor waitstaff wallet check expens shoe look enter pay ani attent sit drinkless onli custom dure happi hour owner shmooz liquor vendor woman repeatedli use word joke comfi loung seat next someon need get messag upscal real imagin onli way succeed develop east edg matter desper red room richard chen world may think also pittsburgh support onli mani ersatz upscal restaur thank god good riddanc red room
"I really wanted to like this place.  I really did.  But the high prices, snooty wait staff and completely wrong-headed ""creativity"" of the chef (wrong-headed combinations of flavors) just turned me off.",1,realli want like thi place realli high price snooti wait staff complet creativ chef combin flavor turn
"iI just visited the LJS restaurant in New Kensington on Nov. 8, 2012 after not having visited it in awhile and was hungry for the fish & hush puppies.  I could not get over
how dirty the floor in the dining area was with paper and bits of garbage under almost all the tables.  It looks like it has't been swept in awhile.  There was a broom and dust pan leaning up against the pop machine & I was tempted to use it myself to sweep up.  I think it will sure be a long while before I visit that location again.",1,ii visit lj restaur new kensington visit awhil wa hungri fish hush puppi could get dirti floor dine area wa paper bit garbag almost tabl look like swept awhil wa broom dust pan lean pop machin wa tempt use sweep think sure long befor visit locat
"Dirty, mismanaged. People behind counter can't seem to keep the simplest order straight.",1,dirti mismanag peopl behind counter ca seem keep simplest order straight
"Absolutely terrible. Less than mediocre. I ordered in advance and they hadn't made it when I got there. The people who work there are also rude. Even though they made it ""fresh,"" my shawarma was cold and gross. The falafel were like rocks. Do not eat here. I think Amir's is much better.",1,absolut terribl mediocr order advanc made got peopl work also rude even though made fresh shawarma wa cold gross falafel like rock eat think amir much better
"un drole de gout chimique
assiette trop couteuse
peu de légumes 
pire resto libanais que j'ai gouté",1,drole gout chimiqu assiett trop couteus peu légume pire resto libanai gouté
"So, its Friday night and we decide to drive 40 miles to try Lone Star.  I asked my daughter to call and see if she can get us a reservation since I hate to wait.  She made the call and was told that we didnt need a reservation and ""they would take care of us when we got there"".  Okay?   When we walked in to the Lone Star there was 3 or 4 couples waiting to be seated and I was told it would be 15 minutes.  I asked if they accepted reservations and was told ""only for 6 or more people"".  How nice.  

We were seated about 15 minutes later and promptly waited on.  The server had no expression, no personality, no nothing....  Like a robot.  

Our food was average and best and very salty.  It was nothing special and the bill was about $75.00 for two adults and two teenage girls.   

We will not be returning....",2,friday night decid drive mile tri lone star ask daughter call see get u reserv sinc hate wait made call wa told didnt need reserv would take care u got okay walk lone star wa coupl wait seat wa told would minut ask accept reserv wa told onli peopl nice seat minut later promptli wait server express person noth like robot food wa averag best veri salti wa noth special bill wa two adult two teenag girl return
"Boy is the name a temptation.Seriously :)  I'll try to be fair though but I'm writing at a time were this restaurant was truly life changing. So much so that I'm buying a dining room table, additional gear for the kitchen and not frequenting any chain while I'm in my hometown based on the strength of this experience. Even in a good mood this place wouldn't be breaking a 2.5 . I'm not in a good mood.  

Texas cheese fries. Pretty tasteless,mess of uncrisp steak fries that are meant to be Monterrey jack , cheddar and bacon. Either the cheese mixed itself together really well or that's not what I had. Bacon , mm that is a very generous term for the toe nail clippings of meat that ended up atop it. Saving grace was only ordering 1/2 an order.

Kid's meal.  Holy crap dried and scraggly carrots accompanied the most basic hot dog imaginable on the most generic bun. No refill offered this time on drink, no straw either.   By far the most cynical  kid's meal I've met. Sure make a profit but don't take the piss!  Fresh carrots are not hard to do , with white film on them.. sorry you've just earned a  1 star. Should have walked out, didn't. :( 

Entrees.

Cajun steak . Claims to be marinated in spices that I couldn't find. They may indeed have shown them a picture of the process in the recipe but I couldn't find it. Meant to be medium rare but was medium on one side , rare on the other, close though:) 

Sirloin steak. Cooked as requested , a bit over seasoned. 

Sides: Twice baked potato.  If you ever want to open up a salt mine these guy will do it for you. You want an idea of what it's texture was?  Twice chewed would be a better name. Warm vomit with bacon bits would be  a slightly more colorful, and chunky, term.

Fried onions:   came with whatever was stuck to the grill they came from.The mushrooms were the only thing that were as tasteful as expected. They looked very consistent though,  canned?   Never mind they were edible: 

Steak soup,really more a stew,but tasted pretty good.  Overall service was ok'ish but walking the kid to the toilet twice the staff just seemed  to want to get to where they wanted to go and not care for the toddler walking up the aisle to the restroom in front of me.  ( that's for this occasion only , past two times it's been great fun for the kid,)

1.5 rounded to 1 for the carrots.",1,boy name tri fair though write time thi restaur wa truli life chang much buy dine room tabl addit gear kitchen frequent ani chain hometown base strength thi experi even good mood thi place would break good mood texa chees fri pretti tasteless mess uncrisp steak fri meant monterrey jack cheddar bacon either chees mix togeth realli well bacon mm veri gener term toe nail clip meat end atop save grace wa onli order order kid meal holi crap dri scraggli carrot accompani basic hot dog imagin gener bun refil offer thi time drink straw either far cynic kid meal met sure make profit take piss fresh carrot hard white film sorri earn star walk entre cajun steak claim marin spice could find may inde shown pictur process recip could find meant medium rare wa medium one side rare close though sirloin steak cook request bit season side twice bake potato ever want open salt mine guy want idea textur wa twice chew would better name warm vomit bacon bit would slightli color chunki term fri onion came whatev wa stuck grill came mushroom onli thing tast expect look veri consist though never mind edibl steak soup realli stew tast pretti good overal servic wa walk kid toilet twice staff seem want get want go care toddler walk aisl restroom front thi occas onli past two time great fun kid round carrot
"Grade: D

Nice place. Nasty, overpriced food. Dopey but hot servers.",2,grade nice place nasti overpr food dopey hot server
"it was restaurant week. we read over the menu & loved it. i called & left a message for a reservation. No one returned my call by the next afternoon, so i called again. i spoke with a man that said he was so sorry, but they had had a gas leak & ended up closed for a few days. we made reservations for tues., the 23rd at 6pm. he had my name  & #.
we live in the s. hills, they're in etna. tom left work early so he could come home & shower. we left & fought through rush hour traffic in 2 directions. we pulled up across the street from it, trying to find it. finally, we saw it, dark! dark, dark, dark!!! my hubby went to the door. there was a note saying, sorry, we're closed still from a gas leak & frozen pipes! WHAT??? we just drove all the way over here, for nothing?! they didn't even have the decency to call us! 
NOT a good thing at all! i didn't want to give them any stars, but i had to, so they just get 1.",1,wa restaur week read menu love call left messag reserv one return call next afternoon call spoke man said wa sorri ga leak end close day made reserv name live hill etna tom left work earli could come home shower left fought rush hour traffic direct pull across street tri find final saw dark dark dark dark hubbi went door wa note say sorri close still ga leak frozen pipe drove way noth even decenc call u good thing want give ani star get
This place has really gone downhill. It used to be great. The last couple times I've been the food was not great. The fried foods were over cooked and burnt on the outside but the inside was soggy. Service was good. I would pass next time you think about going here.,2,thi place ha realli gone downhil use great last coupl time food wa great fri food cook burnt outsid insid wa soggi servic wa good would next time think go
This place has pretty awesome food but the filth of the restaurant and the trash of the staff completely make the experience awkward and sour.  Oh and it's a little pricey for being a diner/cafe.,2,thi place ha pretti awesom food filth restaur trash staff complet make experi awkward sour oh littl pricey
"Went on a week night for an early dinner - there were not that many tables occupied.  First off, as soon as we walked through the door we were hit with a bad odor (it smelled like a sewage/ventilation problem?).  Having been there several times before, I knew not to expect ambiance and that is one thing, but it could really stand a good cleaning (everything just looked like it would be sticky to touch, the table had something that looked like a dead bug stuck to it, walls were splattered with who knows what, and the menus were FILTHY -  I could go on....).  

We started with a cup of french onion soup with a side of french bread (both delicious).  For the main dish we split the chicken crepe and chicken salad sandwich.  The sandwich was very good.  The crepe was really very, very rich.  Did not like that the crepe was folded and not stuffed, and there was too much sauce for our taste.  I have had this before but probably would not order it again.  Ordered a plain crepe with sugar.  This took FOREVER to come out.  In the meantime the waitress was nowhere to be found - she did not offer a refill on my coffee, nor did she clear the dishes.  There were only a handful of tables occupies, and I counted at least 3 females and 1 or 2 male staff, so as far as I was concerned there was no excuse.  When the dessert finally came, dirty dishes still on table, I asked for a coffee refill but never did get it.  And there was no apology for the wait.  The dessert crepe itself was so-so - soggy on the bottom from moisture.  My family said that they much prefer the crepes I make at home.

Overall, a disappointment, as I would sooo love a decent crepe place nearby.",2,went week night earli dinner mani tabl occupi first soon walk door hit bad odor smell like problem sever time befor knew expect ambianc one thing could realli stand good clean everyth look like would sticki touch tabl someth look like dead bug stuck wall splatter know menu filthi could go start cup french onion soup side french bread delici main dish split chicken crepe chicken salad sandwich sandwich wa veri good crepe wa realli veri veri rich like crepe wa fold stuf wa much sauc tast thi befor probabl would order order plain crepe sugar thi took forev come meantim waitress wa nowher found offer refil coffe clear dish onli hand tabl occupi count least femal male staff far wa concern wa excus dessert final came dirti dish still tabl ask coffe refil never get wa apolog wait dessert crepe wa soggi bottom moistur famili said much prefer crepe make home overal disappoint would sooo love decent crepe place nearbi
"Lazy bunch, always closing way before advertized. Ils sont paresseux et ferme toujours avant l'heure de fermeture.",1,lazi bunch alway close way befor advert paresseux ferm toujour avant fermetur
Je sers mieux mon chien quand je lui donne sa gamelle. Frites posées sur le plateau 5 minutes avant le Burger. Burger d'ailleurs dégueulasse . Rien à rajouter,1,ser mieux chien quand donn gamel frite posé plateau minut avant burger burger dégueulass rien rajout
"We went to the Sherway mall today as a family . We decided to try shaorma and it was our fist and last time to eat at that place . Service was horrible they were inpatient and rude. When it came time to the drinks they didn't have any fountain drinks that they advertised , but noted by $2 each we could get the drinks we wanted in the bottle .",1,went sherway mall today famili decid tri shaorma wa fist last time eat place servic wa horribl inpati rude came time drink ani fountain drink advertis note could get drink want bottl
